,date,content,title,name
8710,2023-11-04,"a few passing clouds PERIOD Low 39F PERIOD Winds light and variable. pERIOD

A few passing clouds PERIOD Low 39F PERIOD Winds light and variable PERIOD

Updated November     pm

Were always interested in hearing about news in our community PERIOD Let us know whats going on

If youre interested in submitting a Letter to the Editor click here PERIOD

Humanities Week returned from Oct PERIOD  to  with free online and inperson events around Virginia Techs campus PERIOD

Virginia Tech mens soccer fell to No PERIOD  North Carolina Wednesday night in the first round of the ACC tournament  a loss that puts the nail in the coffin on the Hokies season PERIOD

While most of spooky seasons special events have come to pass fall is far from over with plenty of fun festivities still in store for Hokies hoping to embrace all the season has to offer PERIOD Southwest Virginia hosts events and has natural beauty for students to enjoy with family friends or 

An open letter to President Sands

Search salaries of employees from Virginia Tech and other universities dating back to  PERIOD

Despite the pandemic waging its war on large gatherings and concerts theres a band in town bringing a fresh alternative sound to Blacksburg Chimpanzees and Cigarettes PERIOD

Were always interested in hearing about news in our community PERIOD Let us know whats going on

Getting ready for a classic Hokie football game is a process needless to say PERIOD Theres the process of matching your outfit to the school colors coordinating where to sit with friends and the most important  what music youre listening to before the game PERIOD Luckily the Collegiate Times edito

The holidays are approaching quickly and its the season of joy love and subpar Christmas romcom movies PERIOD It was hard to feel enthusiastic about Love Hard Netflixs new holiday movie release when its predecessors  The Princess Switch and A Christmas Prince  have been so disappoin

Feel the need to cry over your ex on a random Tuesday night Lucky for you Adeles new album  features  songs that follow the theme of love passion and despair PERIOD

The side of Moss Arts Center was transformed into a performing arts stage on Friday Sept PERIOD  and Saturday Sept PERIOD  PERIOD BANDALOOP innovators of vertical dance took to the skies as they glided across the glass windows of the arts center PERIOD The dancers performed elegant flips and emotive spins 

Though Valentines Day can be a great time to celebrate a partner its also a great day to celebrate other things you love about life  passions friendships and of course yourself PERIOD Dont forget to check out some of these great films this Sunday that celebrate single life PERIOD

The Super Bowl is upon us PERIOD It will be sure to be an exciting event full of defining plays bigbudget commercials and another unforgettable halftime performance PERIOD For anyone who hasnt been keeping up heres everything important to know about this Sundays Super Bowl LV PERIOD

After  years Paul McCartney is back with his third installment of homemade solo albums McCartney III released just before Christmas PERIOD McCartneys first selftitled album in  was a raw and experimental DIY project recorded in response to the Beatles unraveling with the second alb

If you are on the lookout for a cheesy romance novelesque series to watch Bridgerton might be just what you need PERIOD Brought to Netflix on Dec PERIOD  this show is based on a series of novels by Julia Quinn which each follow a member of the Bridgerton family as they grow into adulthood and sea

Soul is a truly inspired film PERIOD It blends a fantastic score an interesting premise unique art and great voice performances by Jamie Foxx and Tina Fey to create one a to create one of the best DisneyPixar movies in years PERIOD The film is a heartfelt moving adventure that poses interesting qu

Students all over have returned back to their hometowns to celebrate the holidays with their families enjoying the many traditions that come with the season and some very deserved time off PERIOD As for traditions my family doesnt do gingerbread house contests themed Christmas trees or run Dec

With outstanding performances from newcomer Emma Corrin and Gillian Anderson the latest season of The Crown provides behindthescenes insight into Prince Charles and Princess Dianas relationship political turmoil under Margaret Thatchers United Kingdom and the pulling tendency to uph

Season  of Greys Anatomy ended abruptly when episode  aired on ABC on April  PERIOD Originally supposed to include  episodes the seasons production was suspended in March due to the COVID19 pandemic which left the storylines up in the air and the season openended PERIOD

Despite the pandemic waging its war on large gatherings and concerts theres a band in town bringing a fresh alternative sound to Blacksburg Chimpanzees and Cigarettes PERIOD

Broaching the subject of a presidential memoir is a difficult one now more than ever PERIOD One struggles to find the words needed to ease into it after all what more needs to be said about the forty-fourth president The Obama administration lasted eight years was a success in some regards a failure

The holiday season will surely look a lot different this year with many sinking into the newest holiday TV releases to return to a small sense of normalcy PERIOD Dash and Lily Netflixs new eightepisode series based off the book Dash and Lilys Book of Dares written by David Levithan and Rac

At this point in time what more needs to be said about Elvis Costello As one of the leading voices in alternative music from his beginnings in the late 70s he rose to prominence on the strength of three homerun albums in a row with My Aim is True This Years Model and Armed Forces

Contrary to what you may think the title Remote is not a nod to the fact that the three band members of Wallows never came in contact with each other during the entirety of recording their new EP PERIOD According to an interview in DIY Mag band member Dylan Minnette claims the concept was to

If you only know The Roots as the house band of Jimmy Fallons Tonight Show then you know the funloving band that provides the necessary soundtrack and sound effects of Fallons various show segments many of which revolve around musical impressions of some kind with his guests PERIOD The Root

Well this is an unusual comeback PERIOD Normally if an artist hasnt released new music in several decades their triumphant return is a blockbuster event worthy of trumpets and parades PERIOD But in the case of Patty Smyth not to be confused with Patti Smith Its About Time only her third albu

Just when you thought TiK ToK was just a catchy song by Keha from  years ago the popular app TikTok formerly known as Musical.ly exploded in popularity this year as the world population was forced to stay at home PERIOD TikTok is an app where users can make and share short videos and was ori

Success An email has been sent to  with a link to confirm list signup PERIOD

Error There was an error processing your request PERIOD

Your browser is out of date and potentially vulnerable to security risks.We recommend switching to one of the following browsers",Entertainment | collegiatetimes.com,Virginia Polytechnic Institute
