,date,content,title,name
4357,2022-09-06,"last year the Pac12 lost two schools as USC and UCLA declared to join the Big  in  PERIOD In the last week six more schools have decided to leave the conference and now only four remain PERIOD

University.. PERIOD

For college sports fans the sky is falling PERIOD

The USC Trojans and UCLA Bruins announced Thursday they plan to leave the Pac12 conference and join the Big Ten conference in  PERIOD

On Friday the Pac12.. PERIOD",Big Ten Conferene – The Daily Evergreen,Washington State University
