,date,content,title,name
4907,1970-01-01,"

Junior guard Buddy Hield drives to the basket during the March  game against Kansas at The Lloyd Noble Center. hield scored a teamhigh  points in the  victory over the Jayhawks PERIOD

The Big  mens basketball tournament kicks off on Wednesday with two playin games PERIOD Oklahoma earned a firstround bye with a thirdplace finish in the conference and will not take the court until the quarterfinal round PERIOD

No PERIOD  Kansas State vs PERIOD No PERIOD  TCU

No PERIOD  Texas vs PERIOD No PERIOD  Texas Tech winner plays No PERIOD  Iowa State

No PERIOD  Oklahoma vs PERIOD No PERIOD  Oklahoma State

No PERIOD  Baylor vs PERIOD No PERIOD  West Virginia

Success An email has been sent to  with a link to confirm list signup PERIOD

Error There was an error processing your request PERIOD

Tuesday Thursday and Saturday

Wednesday Friday and Sunday





Robust news organizations like ours generate civic good that informs improves and inspires communities PERIOD For those invested in OU and Norman OU Daily uniquely has

 Free independent local journalism thats routinely honored at collegiate state and national levels

 The citys largest reporting staff largely drawn from one of the nations top journalism colleges

 A veteran advising staff with a mission to build on our legacy as a launching pad for media professionals

Whether in a onetime donation or a recurring pledge please 
CONTRIBUTE TO OUR MISSION PERIOD",Kick-off for Big 12 begins Wednesday | Sports | oudaily.com,University of Oklahoma
