,date,content,title,name
5808,2020-03-26,"posted By Dalton Tevlin
October  

After their homecoming victory against Charlotte The Panthers are back on track heading into their matchup against the University of Texas at El Paso PERIOD

The Panthers relied heavily on the run game against the 49ers and hope to continue that trend against the Miners PERIOD

Running backs Anthony Jones and Napoleon Maxwell led the way on the ground and that onetwo combo in the backfield hope to carry that success into this weekend PERIOD

Quarterback James Morgan was a solid game manager against the 49ers and proved he can take a step back and allow the weapons around him to make plays PERIOD

The next four games for the Panthers will be crucial for the Panthers season PERIOD Four consecutive conference games in a row mean the Panthers will need to nearly flawless if they have hopes for the Conference USA championship

The Miners are currently  to start the season as their offense has been struggling breaking the  point mark twice PERIOD

The Panthers have scored over  points in every game since week three against New Hampshire and have put over  points on the board the last two weeks PERIOD

The FIU offense has certainly hit their stride and is looking like the topranked CUSA offense from last year PERIOD

While Panthers have been rolling they will need to capture that momentum and focus on getting a win if they want their season to be relevant PERIOD Currently sitting  in CUSA east the next few weeks are mustwins against their conference rivals PERIOD

The Panthers will be back in action against the UTEP Miners on Saturday Oct PERIOD nineteenth at  p.m PERIOD at Riccardo Silva Stadium PERIOD

Football Sports

Basketball Football Mens Basketball Sports

Soccer Sports Womens Soccer

Columns Sports

Your email address will not be published PERIOD

Comment

Name 

Email 

Website





Your name

Your email

Subject

Your message optional



FIU Student Media includes PantherNOW Magazine and PantherNOW.com which are edited and produced by students at FIU PERIOD

We publish every Wednesday during the regular academic year PERIOD We also publish daily online content PERIOD

The Roar WRGP is the studentrun radio station which operates   on . in Miami . in North Miami and . in KendallHomestead area PERIOD

 FIU Student Media",FIU Football Evens Their Record Heading Into UTEP - PantherNOW,Florida International University
