,date,content,title,name
361,2016-06-08,"ryan Boyle
Journal Staff

In a midmorning email to students Andrew Meyer Chairman of the Board of Trustees announced the Suffolk University Presidential Search Committee PERIOD A copy of the email is.. PERIOD

OPINION Password sharing is caring Netflixs new policy limits users

OPINION Bill Belichick is washed up its time to move on

Students share experiences opinions at accreditation open forum

OPINION If Trump skips the third republican debate it could spell the end of his campaign

OPINION If it werent for COVID I wouldnt feel like I was still in lockdown

Your School PERIOD Your Paper PERIOD Since  PERIOD",PSC – The Suffolk Journal,Suffolk University
