,date,content,title,name
7691,1970-01-01,"i appreciate serious informed debate over new ideas and concepts PERIOD In that light I offer the following facts in response to your editorial Thursday Meditation movement lacks proper credentials ODE Nov PERIOD  PERIOD

Fact The National Institutes of Health has granted  million to study the health benefits of Transcendental Meditation  in particular benefits for reducing heart disease hypertension and the effects of a stroke PERIOD This research has been published in leading peerreviewed scientific journals PERIOD The studies have been conducted by the NIHfunded Center for Natural Medicine and Prevention at Maharishi University of Management as well as by more than a dozen other independent universities and health centers including CedarsSinai Hospital in Los Angeles and the West Oakland Health Center in Oakland Calif PERIOD

Fact Three hundred students at American University in Washington D.C. are now taking part in a twoyear study by the AU Psychology Department on the effects of TM on brain behavior and health PERIOD Similar studies are now under way on the effects of TM on ADHD high blood pressure grades and overall academic achievement anxiety and depression and substance abuse at middle schools high schools and universities around the country PERIOD

Fact Research on the effects of collective Transcendental Meditation practice has been published in several peerreviewed journals including the Journal of Conflict Resolution Social Indicators Research and the Journal of Mind and Behavior PERIOD

Fact There is no scientific evidence to suggest that all meditation practices are the same PERIOD In fact over the past  years there have been several metaanalyses distinguishing the effects of TM from other techniques including studies published in the American Psychologist the Journal of Clinical Psychology and the Journal of Social Behaviour and Personality PERIOD

Fact The course fee to learn Transcendental Meditation is about the same as the cost of a 3unit course at most universities PERIOD However the TM course is not just one semester but includes personal instruction from a qualified TM instructor as well as a lifetime of followup meditation instruction at thousands of meditation centers around the United States and the world PERIOD The Lynch Foundation is providing full scholarships to students at schools colleges and universities throughout the country PERIOD

Fact Transcendental Meditation is not a religion PERIOD It is taught and practiced by people and clergy of all religions  and to people with no religious beliefs PERIOD Well before scientists began to explore the effects of TM a judge in New Jersey in  concluded there were religious elements to the teaching of TM PERIOD However as we all know there is a long tradition in the American judicial system see civil rights in the south where decisions are overturned with new evidence PERIOD Transcendental Meditation is offered to students of all religions in scores of educational institutions throughout the United States PERIOD

David Lynch did not come to the University of Oregon to persuade anyone to meditate PERIOD He came to answer questions about his filmmaking his creative process and his meditation practice PERIOD And to offer if anyone is interested to help provide them with the tools to dive within. it was  and is  a simple genuine offer from a brilliant artist and a rare human being PERIOD

Best wishes PERIOD

Bob Roth is the Vice President for the David Lynch Foundation for ConsciousnessBased Education and World Peace

The Daily Emerald is the news division of Emerald Media Group University of Oregons independent student media organization PERIOD

EDITOR in CHIEF
Evan Reynolds541  Ext PERIOD  
editordailyemerald.com

Your browser is out of date and potentially vulnerable to security risks.We recommend switching to one of the following browsers

PRESIDENT  PUBLISHER
Eric Henry   Ext PERIOD 
            ehenrydailyemerald.com

VP OPERATIONS
Kathy Carbone   Ext PERIOD 
            kcarbonedailyemerald.com

AD DIRECTOR
Shelly Rondestvedt541  Ext PERIOD 
            srondestvedtdailyemerald.com

CREATIVE  TECHNICAL DIRECTOR
Anna CK Smith541  Ext PERIOD 
            creativedailyemerald.com

Daily Emerald published by Emerald Media Group   University St PERIOD Suite   Eugene OR    Terms  Privacy  Copyright   All Rights Reserved",Clearing up facts about Transcendental Meditation | Archives | dailyemerald.com,University of Oregon
