,date,content,title,name
4949,1970-01-01,"oklahoma lawmakers will have several prominent issues waiting for them when they convene today at noon to kick off the spring sessions of the state House of Representatives and state Senate PERIOD

These include dealing with an unbalanced state budget during a national recession pressure from higher education officials for more funding and the need for cooperation between a newly Republican controlled legislature and a Democratic governor PERIOD

Gov PERIOD Brad Henry will deliver his annual State of the State address today when the legislature convenes PERIOD He is expected to talk about his plans for  and present his budget for the state PERIOD

Senate Republicans who are in the majority for the first time in the history of the Oklahoma State Senate have announced their plans for the spring session PERIOD The session will last until May  PERIOD

They called for a fairer and more business friendly tax policy reform of the archaic and businessunfriendly legal system in Oklahoma and to continue to improve our states infrastructure in a press release PERIOD

The Senate Democrats also released their agenda for the session stating in a press release they want to build on Oklahomas strength in the energy sector to grow the economy and protect the environment. they also said they want to make college more affordable PERIOD

Oklahoma higher education officials said in November they would freeze tuition if lawmakers granted them more than  million in new state funding PERIOD Legislators however have so far balked at this proposal PERIOD

In a email letter sent to all OU students faculty and staff members OU President David Boren acknowledged the state will not be able to provide the new funding higher education officials desire PERIOD

Because of this shortfall it is very unlikely that the state will be able to provide sufficient funding increases for the university Boren said in the email PERIOD

He said he remains optimistic that tuition will remain at its current level and no faculty layoffs will have to occur PERIOD

Robust news organizations like ours generate civic good that informs improves and inspires communities PERIOD For those invested in OU and Norman OU Daily uniquely has

 Free independent local journalism thats routinely honored at collegiate state and national levels

 The citys largest reporting staff largely drawn from one of the nations top journalism colleges

 A veteran advising staff with a mission to build on our legacy as a launching pad for media professionals

Whether in a onetime donation or a recurring pledge please 
CONTRIBUTE TO OUR MISSION PERIOD",Education on the agenda as legislature opens | News | oudaily.com,University of Oklahoma
