,date,content,title,name
7720,2019-07-23,"

















Eugene Emeralds first baseman Grayson Byrd  sends the ball flying.The Eugene Emeralds take on the Boise Hawks at PK Park in Eugene Ore PERIOD on July   PERIOD Kimberly HarrisEmerald

Eugene Emeralds right fielder Darius Hill  keeps an eye on the ball as he runs to the next base.The Eugene Emeralds take on the Boise Hawks at PK Park in Eugene Ore PERIOD on July   PERIOD Kimberly HarrisEmerald

Boise Hawks players watch the game from the dugout.The Eugene Emeralds take on the Boise Hawks at PK Park in Eugene Ore PERIOD on July   PERIOD Kimberly HarrisEmerald

Boise Hawks first baseman Michael Toglia  and Eugene Emeralds right fielder Darius Hill  await the pitch.The Eugene Emeralds take on the Boise Hawks at PK Park in Eugene Ore PERIOD on July   PERIOD Kimberly HarrisEmerald

Boise Hawks pitcher Fineas Del BontaSmith  throws the ball.The Eugene Emeralds take on the Boise Hawks at PK Park in Eugene Ore PERIOD on July   PERIOD Kimberly HarrisEmerald

Sluggo the Eugene Emeralds mascot watches the game from the stands PERIOD The Eugene Emeralds take on the Boise Hawks at PK Park in Eugene Ore PERIOD on July   PERIOD Kimberly HarrisEmerald

Eugene Emeralds right fielder Jacob Olson  swings the bat.The Eugene Emeralds take on the Boise Hawks at PK Park in Eugene Ore PERIOD on July   PERIOD Kimberly HarrisEmerald

Boise Hawks starter Luke Chevalier  prepares to throw the ball.The Eugene Emeralds take on the Boise Hawks at PK Park in Eugene Ore PERIOD on July   PERIOD Kimberly HarrisEmerald

Boise Hawks shortstop Ezequiel Tovar  is ready to swing.The Eugene Emeralds take on the Boise Hawks at PK Park in Eugene Ore PERIOD on July   PERIOD Kimberly HarrisEmerald

The Daily Emerald is the news division of Emerald Media Group University of Oregons independent student media organization PERIOD

EDITOR in CHIEF
Evan Reynolds541  Ext PERIOD  
editordailyemerald.com

Your browser is out of date and potentially vulnerable to security risks.We recommend switching to one of the following browsers

PRESIDENT  PUBLISHER
Eric Henry   Ext PERIOD 
            ehenrydailyemerald.com

VP OPERATIONS
Kathy Carbone   Ext PERIOD 
            kcarbonedailyemerald.com

AD DIRECTOR
Shelly Rondestvedt541  Ext PERIOD 
            srondestvedtdailyemerald.com

CREATIVE  TECHNICAL DIRECTOR
Anna CK Smith541  Ext PERIOD 
            creativedailyemerald.com

Daily Emerald published by Emerald Media Group   University St PERIOD Suite   Eugene OR    Terms  Privacy  Copyright   All Rights Reserved",Photos: Emeralds defeated by Boise second night in a row | Multimedia | dailyemerald.com,University of Oregon
