,date,content,title,name
5666,2023-11-04,"partly cloudy skies PERIOD Low 36F PERIOD Winds light and variable. pERIOD

Partly cloudy skies PERIOD Low 36F PERIOD Winds light and variable PERIOD

Updated November     pm



Wait Before you go sign up for The Quad our enewsletter to get JMU news delivered to your inbox PERIOD

Success An email has been sent to  with a link to confirm list signup PERIOD

Error There was an error processing your request PERIOD

CNN has announced a dramatic shakeup of its programming schedule including new anchors for the morning daytime primetime and weekend shows PERIOD

Inside Politics Sunday host Abby Phillip will anchor the news networks  pm hour on weekdays with chief legal analyst Laura Coates anchoring the  pm slot PERIOD Elsewhere chief national affairs analyst Kasie Hunt will anchor Early Start following the departure of the shows longtime host Christine Romans last month PERIOD

CNNs This Morning is also receiving a makeover following the recent controversy that saw Don Lemon fired after making sexist remarks PERIOD The morning shows longtime cohost Kaitlan Collins also exited the program to host the networks  pm hour replacing Chris Cuomo who was fired in  amid an inquiry into whether he aided his brother former New York Governor Andrew Cuomo PERIOD

Phil Mattingly CNNs chief White House correspondent will now cohost This Morning alongside the shows longtime anchor Poppy Harlow PERIOD

The lineup also includes brand new shows for Christiane Amanpour Chris Wallace Victor Blackwell Pamela Brown and Manu Raju PERIOD

In addition this fall will see the premiere of King Charles presented by Gayle King and Charles Barkley PERIOD The limited series debuting on Wednesdays at  pm will feature freewheeling authentic and dynamic conversations centered around the people and events shaping our culture PERIOD

Anderson Cooper will remain as anchor of the networks  pm slot preceded by Erin Burnett at  pm PERIOD

Former CNN Tonight host Alisyn Camerota will move to a new role doing longform reporting primarily for the Sunday series The Whole Story with Anderson Cooper PERIOD

One of CNNs key differentiators is our deep roster of experienced journalists reporters and storytellers said CNN Worldwides leadership team Amy Entelis David Leavy Virginia Moseley and Eric Sherling PERIOD Many joined CNN early in their careers and have grown with the network throughout the years PERIOD They are extraordinarily talented and share the same CNN sensibility versatility determination and an inquisitive and empathetic approach to reporting the news. the statement continued By expanding the range and depth of our programming lineup across multiple dayparts we are strengthening our reporting excellence throughout the schedule elevating our ability to tell great stories across platforms and doubling down on CNNs position as the most trusted name in news. more Headlines

Originally published on tvinsider.com part of the BLOX Digital Content Exchange PERIOD

Success An email has been sent to  with a link to confirm list signup PERIOD

Error There was an error processing your request PERIOD

The latest JMU news delivered to your inbox on Mondays and Thursdays PERIOD

Want to praise someone or get something off your chest  Darts and Pats is the place to do it PERIOD

The latest headlines from The Breeze delivered twice a week to your email inbox PERIOD

Success An email has been sent to  with a link to confirm list signup PERIOD

Error There was an error processing your request PERIOD

Your browser is out of date and potentially vulnerable to security risks.We recommend switching to one of the following browsers",CNN Announces Huge Changes to Programming Lineup | Entertainment | breezejmu.org,James Madison University
