,date,content,title,name
5510,1970-01-01,"

Dance is often its own language PERIOD

It can tell stories that audiences can relate to and preserve cultures that may have faded from view PERIOD

The Philadelphia Dance Company also known as Philadanco embraces these aspects of dance in the groups performances PERIOD

This was seen Monday as Philadanco performed a four part show at the Clarence Brown Theatre PERIOD The event was sponsored by the Black Cultural Programming Committee and Multicultural Student Life PERIOD

Philadanco was founded in  by Joan Myers Brown and is a nonprofit organization that works to strengthen the skills of dancers and choreographers and increase appreciation for dance according to its website PERIOD

Its inception was inspired by the need for a school for black dancers who were denied entry to other dance schools PERIOD

They are also known for their creativity welltrained dancers and preservation of AfricanAmerican style dance PERIOD Their mission is to teach youth leadership and development skills to help them succeed in both dance and everyday life PERIOD

The first of the four 20minute dances was  featuring glittering costumes and several solo dances choreographed to upbeat funk music PERIOD

 Stacey Rooks junior in child and family studies said PERIOD 

The second was titled  a dance involving many partner solos as well as group choreography PERIOD

After intermission  was performed PERIOD This third section was made up of different dances incorporating real life situations PERIOD In one instance a woman was depicted dancing for money and another told the story of a broken marriage PERIOD

Darrisha Triplet a student at Austin East High School named  as her favorite piece at the event PERIOD

 Triplet said PERIOD

The last dance was entitled  For this the dancers wore costumes that resembled military jackets and danced mostly in pairs or as a group PERIOD

 said Natasha Wicker freshman in the Arts and Sciences PERIOD 

Rooks a member of the Black Cultural Programming Committee said the Philadelphia Dance Company shows their love for dance through their performances PERIOD

 Rooks said PERIOD 

The Black Cultural Programing Committee is sponsoring more events this semester including  on Nov PERIOD  PERIOD This will feature comedian Gary Owen from  as well as Robert Powell and Gene Harding according to the event program PERIOD

A homecoming package will be sold to UT students for  until Oct PERIOD  including tickets for both the comedy event and Stomp Fest PERIOD

More information on upcoming events hosted by the Black Cultural Programming Committee can be found on its website multicultural.utk.edubcpcindex.php PERIOD Further information on the Philadelphia Dance Company and their program can be found on their website or Facebook page PERIOD









Log In

Keep it Clean PERIOD Please avoid obscene vulgar lewd
racist or sexuallyoriented language PERIOD
PLEASE TURN OFF YOUR CAPS LOCK PERIOD
Dont Threaten PERIOD Threats of harming another
person will not be tolerated PERIOD
Be Truthful PERIOD Dont knowingly lie about anyone
or anything PERIOD
Be Nice PERIOD No racism sexism or any sort of ism
that is degrading to another person PERIOD
Be Proactive PERIOD Use the Report link on
each comment to let us know of abusive posts PERIOD
Share with Us PERIOD Wed love to hear eyewitness
accounts the history behind an article PERIOD

Campus and local news delivered to your desktop daily PERIOD

Email Address

By submitting this form you are granting The Daily Beacon permission to email you PERIOD You may unsubscribe via the link found at the bottom of every email PERIOD See our Email Privacy Policy for details. emails are serviced by Constant Contact PERIOD

Tennessee football took down UConn  on Saturday moving to  on the season PERIOD

Your browser is out of date and potentially vulnerable to security risks.We recommend switching to one of the following browsers",Philadanco shines at Clarence Brown Theatre | Arts | utdailybeacon.com,"University of Tennessee, Knoxville"
