,date,content,title,name
3933,1970-01-01,"

A late San Antonio couple donated  million to the Oklahoma State University Foundation to provide funding for the schools Presidents Distinguished Scholarships PERIOD



Horace and Norma Cleveland left the money in their will along with money endowed to several other nonprofit organizations PERIOD



The gift will provide funding for about  students to receive the scholarship PERIOD



 said Becky Krause Foundation

Your browser is out of date and potentially vulnerable to security risks.We recommend switching to one of the following browsers",OSU Foundation receives $1 million  |  | ocolly.com,Oklahoma State University
