,date,content,title,name
5593,1970-01-01,"



The Lady Vols lose to Georgia at Thompson Boling Arena on Oct PERIOD   PERIOD

The Tennessee Lady Vols volleyball team took down the No PERIOD  Missouri Tigers  in five sets      in the spring season opener Friday to improve to  on the year PERIOD

The Lady Vols snapped No PERIOD  Missouris six game win streak that dated back to the fall season while Tennessee extended its win streak to three PERIOD

Tennessee was led by Lily Felts who notched her seventh consecutive doubledigit kill streak with  PERIOD On top of this Felts also recorded  digs solidifying a four game streak with a doubledouble that dates back to November of last season PERIOD

 Coach Eve Rackham said PERIOD

Set four seemed to tell the same story early PERIOD Mizzou jumped out to an  lead needing just seven more points to win the match before Lily Felts took over PERIOD The Knoxville native posted her best set of the day leading the team all the way back to a  set four win after a coaches challenge solidified Felts final attack point PERIOD

Set five was a race to  and Tennessee was up to the challenge PERIOD The Lady Vols and Tigers started the set trading points before Tennessee eventually pulled away to take a  lead following a kill by Ava Bell PERIOD Lily Felts tallied three of the final four points needed to reach  which rewarded the Lady Vols their first victory of the spring season  PERIOD The Lady Vols finished with a hitting percentage of . and are now  on the season when hitting better than . as a team PERIOD

We get to celebrate until  oclock Mahaffey said PERIOD we got two and a half hours then its on to the next game PERIOD We won but we have to be able to do it again

The Lady Vols look to complete the sweep of the Tigers Saturday at  PM ET at ThompsonBoling arena PERIOD You can catch Tennessee on SEC Network  PERIOD









Log In

Keep it Clean PERIOD Please avoid obscene vulgar lewd
racist or sexuallyoriented language PERIOD
PLEASE TURN OFF YOUR CAPS LOCK PERIOD
Dont Threaten PERIOD Threats of harming another
person will not be tolerated PERIOD
Be Truthful PERIOD Dont knowingly lie about anyone
or anything PERIOD
Be Nice PERIOD No racism sexism or any sort of ism
that is degrading to another person PERIOD
Be Proactive PERIOD Use the Report link on
each comment to let us know of abusive posts PERIOD
Share with Us PERIOD Wed love to hear eyewitness
accounts the history behind an article PERIOD

Campus and local news delivered to your desktop daily PERIOD

Email Address

By submitting this form you are granting The Daily Beacon permission to email you PERIOD You may unsubscribe via the link found at the bottom of every email PERIOD See our Email Privacy Policy for details. emails are serviced by Constant Contact PERIOD

Tennessee football took down UConn  on Saturday moving to  on the season PERIOD

Tennessee football took down UConn  on Saturday moving to  on the season PERIOD

This week to celebrate homecoming Ali and Karsten sit down with Beth Haynes a former WBIR10 anchor and UniversityTennessee alumnus PERIOD From her time on Rocky Top to her years as a journalist BethHaynesTV tells it all PERIOD

Your browser is out of date and potentially vulnerable to security risks.We recommend switching to one of the following browsers",Tennessee ends No. 16 Missouri's win streak | Volleyball | utdailybeacon.com,"University of Tennessee, Knoxville"
