,date,content,title,name
670,1970-01-01,"advertisement

Believe it or not there is still something called a bipartisan event in this world where neither liberal nor conservative viewpoints are held over the other PERIOD

One such event is taking place tomorrow at Websters Bookstore Cafs warehouse  S PERIOD Allen St PERIOD

New Yorkbased theater company West fiftieth Street Productions contacted various community and professional theaters across the nation this month in hopes of getting them to perform a readers theater event of sorts called Dear George Letters to the President  PERIOD The performance is based on a collection of actual letters compiled by West fiftieth Street about President George W PERIOD Bush both positive and negative PERIOD

Susanna Ritti president of the State College Community Theater received the request to put on the show PERIOD  Ritti said PERIOD 

The show has been assembled rather quickly and Websters coowner Elaine Meder hopes people understand that the event is neither pro nor antiBush PERIOD

 Meder said PERIOD 

Interwoven with the readings will be performances by The Plastic Ona Band featuring PM Kellermann and Friends PERIOD

Paul Kellermann the groups organizer said the act will consist solely of John Lennon covers PERIOD

 he said alluding to some of the tunes he will cover PERIOD 

Covering Lennon seemed like a clear choice to Kellermann from the start PERIOD  he said PERIOD  he added referring to the recent  concerts touring swing states nationwide in support of Democratic presidential candidate Sen PERIOD John Kerry PERIOD

The band named originated from a combination of The Plastic Ono Band and Kellermanns dog Ona short for onomatopoeia PERIOD

 he said PERIOD

Kellermann makes no attempt to hide his liberal inclinations even to his students but makes sure to keep his powers of persuasion an extracurricular activity and out of the classroom PERIOD

 he said PERIOD 

Despite Kellermanns declared liberal leanings Meder and Ritti thought his act would fit well with the evenings performance PERIOD

 Ritti said PERIOD 

If youre interested in submitting a Letter to the Editor click here PERIOD

Were always interested in hearing about news in our community PERIOD Let us know whats going on

Following a close game against Indiana The  Podcast cohosts Zach Allen and Seth Engle discuss the latest news on Penn State football PERIOD

Success An email has been sent to  with a link to confirm list signup PERIOD

Error There was an error processing your request PERIOD

Going through the highlights of the Penn State and State College news so you dont have to.Sign up todaySent every Thursday PERIOD

Get weekend previews and weekend recaps from The Daily Collegian Sports staff sent to your inbox PERIOD Sent every Friday and Monday PERIOD

Your browser is out of date and potentially vulnerable to security risks.We recommend switching to one of the following browsers",Letters to Bush coming to bookstore  | Arts | psucollegian.com,Pennsylvania State University
