,date,content,title,name
8081,2023-11-04,"attending college is an expensive venture for many students which makes holding a job an important part of many lives .. PERIOD

  JNews  Premium WordPress news  magazine theme by Jegtheme PERIOD

  JNews  Premium WordPress news  magazine theme by Jegtheme PERIOD

Login to your account below







Fill the forms bellow to register







Please enter your username or email address to reset your password PERIOD",Old Navy Archives - The Times-Delphic,Drake University
