,date,content,title,name
1271,2023-07-11,"uNF student died in traffic accident over weekend university confirms

One person shot near UNF campus alert says

Gallery Activists rally for Palestine in Jacksonville

 Jacksonville activists decry U.S PERIOD support of Israel

ProPalestine proIsrael protesters clash at student walkout Wednesday

Jacob Justice Sports Editor

November  

Jeanne Gilbert News Editor

November  

Carter Mudgett Editor in Chief

November  

Ethan Howick Sports Reporter

October  

Jacob Justice Sports Editor

October  



UNFs  StudentRun News Source

Cancel reply

You must be logged in to post a comment PERIOD",- UNF Spinnaker,University of North Florida
