,date,content,title,name
1246,2023-07-11,"sam ChaneyJanuary  

So Long Longboard
A UNF student contacted officials on Jan PERIOD  to report a stolen skateboard that was valued at  PERIOD
According to the police report the student entered the Osprey Commons Cafeteria in Bldg PERIOD  around  p.m PERIOD and placed his skateboard on the nearby skateboard rack PERIOD The skateboard itself was reportedly not locked or secured PERIOD
The student said that he exited the building at approximately  p.m PERIOD and found that his skateboard was no longer on the rack PERIOD According to the report the student then attended a school sponsored meeting in the Student Union before notifying officials of the missing skateboard PERIOD
The report states that no witnesses were located due to the students delay in contacting UNFPD PERIOD
The skateboard was a longboard with blue wheels approximately  long and made of wood PERIOD The top of the skateboard had black decktape with a small mountain logo and the bottom was painted gray with a YinYang symbol PERIOD
Patrol efforts have been suspended due to a lack of evidence or suspects PERIOD

Get In The Car
UNFPD was dispatched to the Osprey Cove on Jan PERIOD  in response to suspicious activity in Lot  PERIOD
The police report states that a female UNF student was walking back to her dorm through Lot  when a vehicle approached her at a high speed PERIOD A male with a strong Indian accent reportedly asked her to enter the vehicle and go with them PERIOD The student says that she walked away and responded Im not getting in the car with you. the vehicle then reportedly sped away in the direction of Lot  and ECO Drive PERIOD
According to the report the suspects were described as three males of Indian descent with short hair possibly driving a silver Mustang with a hardtop PERIOD The student stated that it was the man in the front passenger seat who asked her to enter the vehicle and that the encounter was too brief to ascertain very much information PERIOD
The report states that officials searched the area and found nothing PERIOD
Due to the suspect calling late police cannot do anything further PERIOD



For more information or news tips or if you see an error in this story or have any compliments or concerns contactemailprotected

UNF student died in traffic accident over weekend university confirms

One person shot near UNF campus alert says

Gallery Activists rally for Palestine in Jacksonville

 Jacksonville activists decry U.S PERIOD support of Israel

ProPalestine proIsrael protesters clash at student walkout Wednesday

Jacob Justice Sports Editor

November  

Jeanne Gilbert News Editor

November  

Carter Mudgett Editor in Chief

November  

Ethan Howick Sports Reporter

October  

Jacob Justice Sports Editor

October  

Features

The Red Zone is approaching a higherrisk time of year for sexual assaults

Entertainment

For surfers skaters and gogo dancers a night with Seagate

Entertainment

Surf soap and rock  roll an interview with Yaupon Holly

Baseball

New UNF skipper Joe Mercadante introduced to Osprey community

Latest

UNF Board of Trustees approves new honors housing SB  updates

Features

UNF president wins National Academy of Inventors Sentinel Award

Latest

Comply now grieve later Florida faculty union releases guidance for SB  compliance

Features

Where to celebrate Independence Day around Jacksonville Food Fireworks and More

Latest Stories

Where could the Jaguars play if stadium renovations are approved

Latest

Anger anxiety uncertainty mark last six months of battle waged over Florida university diversity centers fight for existence

UNFs  StudentRun News Source

Cancel reply

You must be logged in to post a comment PERIOD",Police Beat: Stolen skateboard and a creepy car - UNF Spinnaker,University of North Florida
