,date,content,title,name
9712,2020-07-29,"with finals looming the months of May and June are some of the most stressful times for students PERIOD

According to a Gallup report  of associate degree students and  of bachelors degree students.. PERIOD

The month of May is Asian American Pacific Islander Heritage Month PERIOD It recognizes the influence of Asian American and Pacific Islander culture history and achievements across the United States PERIOD

In.. PERIOD

On May  the Hacienda Heights Community Center held a public meeting to discuss the Homekey Project an effort to reduce homelessness in the area PERIOD Chaos ensued as hundreds of attendees sought an opportunity.. PERIOD

On April  the Los Angeles County Sheriff Department WalnutDiamond Bar station held an open house for residents on April  PERIOD

After a line formed outside the station sheriff deputies guided the public.. PERIOD

Video essays have become increasingly popular in todays world and have had a significant influence on various aspects of society particularly in the realm of media and communication PERIOD

The average.. PERIOD

Mt PERIOD SACs athletic programs highlight some of the best players across the country PERIOD Pandemicended seasons did not end each players drive to go forward and win for the college PERIOD

This week SAC Sidelines.. PERIOD

With a twinkle in his eye and one of the biggest smiles anyone has ever seen from Honolulu to Irvine Coach Ron Kamaka is more than a coach PERIOD

Ron is a man of the Lord beloved husband to Lynda and an.. PERIOD

The game of football is a school of hard knocks where lessons are often learned the hard way PERIOD However what is learned on the gridiron is indispensable and prepares the brave and bold to land on their.. PERIOD

It takes grit and resilience to fight for a dream PERIOD Without those traits of character very few get close and even fewer achieve greatness PERIOD This week the former Mountie running back Rachaad White takes.. PERIOD

Its been said that the strongest steel is forged from the hottest fires PERIOD For the Mounties who set out to test the limits of their strength on the basketball court the molten fire of the challenges that.. PERIOD

It takes heart to be a leader to lead by example and have the strength to rise more than you can fall PERIOD That is the grit and fortitude of the SAC Dawg mentality PERIOD This week the former Mountie quarterback.. PERIOD

Whether it is on the gridiron the diamond or hallowed grounds we find passion in the games and competitions we are part of PERIOD This past year has changed the world completely and tested our human capacity.. PERIOD

Chris Evans Accidentally Leaked His Own Nudesand People Arent Mad About It

Inside West Covinas Haunted Park

 Funniest Moments from Frenemies

 Latinx Players Making Noise in The NFL

Generations of Memories Run in the Santa Anita Park

A Student Publication of Mt PERIOD San Antonio College in Walnut CA",Videos – SACMedia,Mt. San Antonio College
