,date,content,title,name
608,2021-04-16,"

Attacker Mac OKeefe  attempts to make a shot towards Michigans goalduring Penn State mens lacrosse game against Michigan on Friday April   at Panzer Stadium in University Park Pa.The Nittany Lions beat theWolverines  PERIOD

Just two weeks after becoming the leading goal scorer in Division I mens lacrosse history and just days after becoming a firstround pick in the PLL draft fifthyear attackman Mac OKeefe has reached another milestone PERIOD

For the third time in his career OKeefe has been named to the AllBig Ten first team PERIOD OKeefe is the first Nittany Lion to be honored as a firstteam honoree three times PERIOD

B1GNews 

 Here is your B1GMLax AllBig Ten First Team 

  httpst.coM0voIJ4A2S pic.twitter.com7JumNJnyMG

With  goals on the season OKeefe ranks seventh in goals scored in the conference and eleventh in points with  PERIOD

Joining OKeefe as a  AllBig Ten honoree is attackman counterpart Dylan Foulds who was named as Penn States Big Ten Sportsmanship Award honoree PERIOD This honor comes a week after Foulds gamewinning score against Ohio State this past Saturday PERIOD

MORE LACROSSE COVERAGE

With their last regular season behind them Mac OKeefe and Gerard Arceri werent in the new

If youre interested in submitting a Letter to the Editor click here PERIOD

Five days removed from very nearly splitting its series with Maryland Penn State returned home in hopes of better fortune against a stalwart 

Penn State was strong on the mound and in the batters box Friday night PERIOD

Just a week after selecting Mac OKeefe with the No PERIOD  overall pick in the PLL Draft Chaos LC has added another Nittany Lion to its roster PERIOD





Success An email has been sent to  with a link to confirm list signup PERIOD

Error There was an error processing your request PERIOD

Going through the highlights of the Penn State and State College news so you dont have to.Sign up todaySent every Thursday PERIOD

Get weekend previews and weekend recaps from The Daily Collegian Sports staff sent to your inbox PERIOD Sent every Friday and Monday PERIOD

Penn State traveled to College Park Maryland to face the Terrapins PERIOD

Success An email has been sent to  with a link to confirm list signup PERIOD

Error There was an error processing your request PERIOD

Going through the highlights of the Penn State and State College news so you dont have to.Sign up todaySent every Thursday PERIOD

Get weekend previews and weekend recaps from The Daily Collegian Sports staff sent to your inbox PERIOD Sent every Friday and Monday PERIOD

If youre interested in submitting a Letter to the Editor click here PERIOD

Your browser is out of date and potentially vulnerable to security risks.We recommend switching to one of the following browsers",Penn State men's lacrosse attackman Mac O'Keefe named to All-Big Ten first team | Penn State Men's Lacrosse News | psucollegian.com,Pennsylvania State University
