,date,content,title,name
375,2016-06-08,"bolivian president Evo Morales named Gina Reque Teran as the general of the army during a ceremony held in La Paz according to multiple outlets PERIOD This makes her the first woman to in Latin America.. PERIOD

OPINION Password sharing is caring Netflixs new policy limits users

OPINION Bill Belichick is washed up its time to move on

Students share experiences opinions at accreditation open forum

OPINION If Trump skips the third republican debate it could spell the end of his campaign

OPINION If it werent for COVID I wouldnt feel like I was still in lockdown

Your School PERIOD Your Paper PERIOD Since  PERIOD",Bolivia – The Suffolk Journal,Suffolk University
