,date,content,title,name
6301,2023-11-04,"sports

Chico State mens soccer ends regular season with a tie

News

Over  raised for victims in Gaza at Palestine vigil

News

Financial analysis of CSU reveals strong financial status

The Big Dipper

Chico State proposes new deadly Lotteryinspired parking solution

Arts  Entertainment

Kappa Sigma wins annual Chili Cook Off

Secondchance opportunities prove to be the difference as junior Malik Duffy led the Chico State mens basketball team to an  victory over the Cal State Dominguez Hills Toros on Thursday.. PERIOD

Forward Haley Ison of the Chico State womens basketball team scored a total of  points on Thursday night however not even this proved to be enough PERIOD The Cal State Dominguez Toros would go on to complete.. PERIOD

Chico States independent student newspaper",Cal State Dominguez Hills Toros – The Orion,CSU Chico
