,date,content,title,name
376,2016-06-08,"by Gabby Pinto

On Friday Sept PERIOD  millions of people lined up in front of Apple stores around the world to get their hands on the new iPhone PERIOD This time Apple released not just one but two new iPhones.. PERIOD

OPINION Password sharing is caring Netflixs new policy limits users

OPINION Bill Belichick is washed up its time to move on

Students share experiences opinions at accreditation open forum

OPINION If Trump skips the third republican debate it could spell the end of his campaign

OPINION If it werent for COVID I wouldnt feel like I was still in lockdown

Your School PERIOD Your Paper PERIOD Since  PERIOD",5S – The Suffolk Journal,Suffolk University
