,date,content,title,name
3391,1970-01-01,"

Candidates for the next UTA president underwent interviews Monday and Tuesday and the Search Advisory Committee set a general time line for selecting a finalist UT System spokeswoman Jenny LaCosteCaputo said PERIOD

The 17member committee is in the process of narrowing down the field of  candidates and will conduct another round of interviews in late November or early December LaCosteCaputo said in an email PERIOD

The goal is to have a finalist for the Board of Regents to consider by February but that timeline depends on how the interviews go she said in the email PERIOD

Per state law names of candidates may not be released to the public until the finalist is named PERIOD

President James Spanioloannouncedhis plans to retire in June but said he will remain in his role until a successor is chosen PERIOD

KristaMTorralva

krista.torralvamavs.uta.edu

Vistasp Karbhari has been named the lone finalist for the UTA president PERIOD Karbhari is provost and executive vice president for academic affairs













Log In

Keep it Clean PERIOD Please avoid obscene vulgar lewd
racist or sexuallyoriented language PERIOD
PLEASE TURN OFF YOUR CAPS LOCK PERIOD
Dont Threaten PERIOD Threats of harming another
person will not be tolerated PERIOD
Be Truthful PERIOD Dont knowingly lie about anyone
or anything PERIOD
Be Nice PERIOD No racism sexism or any sort of ism
that is degrading to another person PERIOD
Be Proactive PERIOD Use the Report link on
each comment to let us know of abusive posts PERIOD
Share with Us PERIOD Wed love to hear eyewitness
accounts the history behind an article PERIOD

Your browser is out of date and potentially vulnerable to security risks.We recommend switching to one of the following browsers",UTA presidential search committee conducts interviews | Campus | theshorthorn.com,University of Texas Arlington
