,date,content,title,name
7949,2023-09-20,"for many young couples summer means dates on the beach romantic cuddles by the campfire and watching the sun go down together PERIOD But for the average college couple this threemonth period often consists of texts phone calls and Skype dates PERIOD

According to statisticbrain.com in the year  an average of  to . million college couples are in a longdistance nonmarital relationship which constitutes around  percent of all college relationships PERIOD These longdistance relationships become even more prevalent during summer break when students often leave their college to travel pursue internships study abroad or return to their hometowns PERIOD Applications like Skype FaceTime and Snapchat help bridge the gap between couples but some say they cannot replace physical intimacy with phone calls and webcam chats PERIOD

Krissy Chun a sophomore majoring in metallurgical engineering met her boyfriend at a fraternity party PERIOD Chun is from Suwanee Georgia and her boyfriend Sean Gordon a junior majoring in criminal justice is from Huntsville Alabama PERIOD

We text from when we wake up till when we go to bed Chun said PERIOD We occasionally talk on the phone and we FaceTime just about every night PERIOD The hardest part is not being able to be with each other physically PERIOD Like just the idea of having him in the room with me and just watching TV is a lot better than just watching TV without him there. according to West Virginia Universitys Students Center for Health communication is a must for surviving long distance relationships PERIOD While technology makes longdistance communication easier than ever before interacting from behind a screen cant replace facetoface conversations PERIOD

Its harder for us to resolve arguments Gordon said PERIOD Im not sure how but when youre in person with each other its easier to fix situations rather than over a text message or a phone call. inperson interactions allow both parties to read each others facial expressions and body language two key elements that aid in understanding how ones partner is feeling PERIOD An article by selfgrowth.com called The Importance of Body Language states that when we connect with a person we also have to make it clear to each other how the content of a spoken message needs to be interpreted PERIOD Without the nuances of facial expression and body language words can lack context and may be misunderstood PERIOD

For Nathan Johnson a senior majoring marketing and Abby Peterson a sophomore double majoring in operations management and restaurant and hospitalitymanagement distance has proven to be a challenge PERIOD Peterson is in Germany for the summer because her family is stationed there with the army while Johnson is in Tuscaloosa PERIOD The sevenhour time difference makes it difficult for the couple to make time for one another PERIOD

We make an effort to try to Skype every day Peterson said PERIOD Things come up and thats not always possible but we usually do a pretty good job of Snapchatting each other every day PERIOD Snapchat makes it a little easier than texting because we have the chance to see each others faces. johnson and Peterson have been dating for a couple of months which Peterson said makes the longdistance relationship easier PERIOD

I think its harder for couples that have been together longer and havent been apart much Peterson said PERIOD My first attempt at a longdistance relationship was about two years ago PERIOD We had been dating over a year but because we didnt know what it was like to be away from each other it was very difficult PERIOD Im not saying its not difficult now with it being so early in our relationship but I think this distance can only make our relationship stronger. johnson believes the opposite saying longdistance relationships are easier for couples who have been together longer PERIOD

Its the first true test Johnson said PERIOD At least its that way for me and Abby PERIOD Couples who have been together longer have generally been through some struggles and know how to deal with them better PERIOD Being apart gets frustrating at times and learning how to make the best of it is key. johnson said the hardest part about being apart is the physical aspect PERIOD

I cant hold her or kiss her through Skype Johnson said PERIOD The time difference has been a little tough but not too bad PERIOD Im able to Skype call her after my morning class and before she goes to bed. for many longdistance couples the prospect of reuniting provides comfort during the months spent apart PERIOD Chun has visited Gordon for his birthday already this summer and Gordon said he plans to visit her for her birthday PERIOD Although Chun said she is looking forward to seeing Gordon she said leaving after her last visit proved to be extremely difficult PERIOD

I cried when I had to leave Chun said PERIOD It was definitely a lot harder than I thought it would be. as challenging as it may be Chun said there is one advantage to embarking on a longdistance relationship PERIOD

I think absence does make the heart grow fonder in a way Chun said PERIOD After not seeing him after a month I was super excited to hang out with him for a week and I definitely realized I liked him a lot more.",Summer break provides obstacles for couples – The Crimson White,University of Alabama
