,date,content,title,name
4259,2015-08-16,"













Brandon Harris is the starting quarterback for Saturdays matchup against McNeese State University saidLSU football coach Les Miles during a Monday afternoon news conference PERIOD

Until Monday Miles had yet to announce his starter PERIOD Harris and quarterback Anthony Jennings were both pinned for the role PERIOD

This summer Anthony Jennings was suspended from the team six weeks after he was arrested PERIOD Jennings charges were drop a few weeks before preseason camp and he returned with the team but Harris still pulled ahead PERIOD

Follow The Daily Reveille for updates to this story PERIOD

If youre interested in submitting a Letter to the Editor click here PERIOD

Got a question Want to share an anonymous news tip Click  to let the Reveilles student journalists know PERIOD

Your browser is out of date and potentially vulnerable to security risks.We recommend switching to one of the following browsers",LSU football coach Les Miles names Brandon Harris as the starting quarterback against McNeese | Daily | lsureveille.com,Louisiana College
