,date,content,title,name
1487,2023-10-26,"news

Angola Prison Rodeo The last vestige of gladiators

News

Wildfire smoke affects air quality

News

Tulane SSI organizes empty Shabbat table service

Multimedia

BREAKING WAVES PODCAST  Episode  Beyond the Banners

Views

OPINION  Be wary of TikToks political influence

Arcade

Taylor Swifts  is back in Style following rerelease

Views

OPINION  Schools Protect your Jewish students

Arcade

Black Pumas sophomore album delivers on contemporary soul

Arcade

Haunting soon in theaters near you

Arcade

Inside the first allBlack production of Macbeth

News

Campus Cats organization keeps cats feline good

Football

Tulane gains road win with  victory at Rice

News

Students call for support amid ongoing Israel Palestine tensions

Letter to the Editor

Letter to the Editor  Why I grabbed the flag

City

ProPalestine proIsrael protestors clash at Tulane

Having only been founded in Fall of  the Tulane Adoption Club Connection  or TACConnection  is one of the youngest recognized student organizations on campus PERIOD

In a statement shared with.. PERIOD

In what seems to be a tradition at Tulane University the F PERIOD Edward Hebert Hall is once again the center of campus controversy PERIOD Most recently Tulane faculty unofficially renamed the building in honor.. PERIOD

This article is the first in a series of interviews and conversations with student leaders regarding the organizations which they represent PERIOD If you would like your organization to participate in this.. PERIOD

Shoutout to my haters sorry you couldnt phase me  Nicki Minaj

Among the things I planned on doing in college writing for The Hullabaloo was not one of them PERIOD Writing for The Hullabaloo and.. PERIOD

This past Monday Kevin Richardson and Raymond Santana members of the Exonerated Five spoke to a crowd of  in the McAlister Auditorium PERIOD The event was cosponsored by the Office of Multicultural.. PERIOD

The following is an opinion article and does not reflect the views of The Tulane Hullabaloo PERIOD

It is unsurprising that the Victory Bell revered by Tulane and integrated in the fabric of this universitys.. PERIOD

Around this time last year my parents my sister and I received our green cards PERIOD After  years we finally became permanent residents of the U.S.

My clearest memory of our U.S PERIOD Citizenship and Immigration.. PERIOD

The day started with a stressful presentation looming over my head. it was for my major seminar class in political economy and had to be at least  minutes long PERIOD I got out of bed early around  a.m... PERIOD

Since Shakira and Jennifer Lopez performed at the Super Bowl people around the country are angry about the raunchiness of the dancing and clothes PERIOD All over Facebook comments speak of families skipping.. PERIOD

Tulane admitted its first Black students in the fall of . in  Tulane enrolled a recordhigh  Black students PERIOD A look back at the history of the Black student experience at Tulane allows for.. PERIOD

The internet makes forming deep connections with people youve never met not only possible but also for younger generations expected PERIOD Online gaming social media and online communities of niche interests.. PERIOD

The Tulane Student Health Center SHC began providing free emergency contraceptives at its oncampus pharmacy Nov PERIOD  PERIOD

Our decision on this was based on the need Students United for Reproductive.. PERIOD

Beyoncs Renaissance World Tour comes to Superdome

Letter to the Editor  Why I grabbed the flag

ProPalestine proIsrael protestors clash at Tulane

Student arrested after proPalestine graffiti appears on Freret TUPD says

Tulane condemns Hamas amid student grief and outcry

The Tulane Hullabaloo with Tulane Truckers

March  

Student newspaper serving Tulane University Uptown New Orleans",Features Archives • The Tulane Hullabaloo,Tulane University
