,date,content,title,name
1345,2023-07-13,"

April   by Jonathan Cohn Leave a Comment

Last week EcoAction cosponsored an event with Campus Ministry on Catholicism and the environment which included a speech by the  Read more... about Earth Day Consider Impact of Daily Actions

March   by Elizabeth Rowe Leave a Comment

In an effort to raise awareness of the world water crisis the Georgetown chapter of UNICEF celebrates UNICEF World Water Week this week as  Read more... about GUUNICEF Fights Crisis Drop by Drop

Copyright    Site Design by  Creative",Eco-Action Archives |,Georgetown University
