,date,content,title,name
4900,1970-01-01,"

OU coach Lincoln Riley watches redshirt junior quarterback Kyler Murray warm up before the game against TCU Oct PERIOD  PERIOD

Time230 p.m PERIOD

WatchFOX

Live streamFoxSportsGo

ListenDirectory

OU football Ronnie Perkins so eager to play he wore cleats to second grade now making an impact as freshman

OU football Kennedy Brooks wait is over

OU football Ruffin McNeill simplifying Sooners defense

OU football Three keys for the Sooners against Kansas State

OU football Meet the Sooners opponent  Kansas State

OUDailySports

GeorgeStoia

AbbyBitterman

CalebMac21

Success An email has been sent to  with a link to confirm list signup PERIOD

Error There was an error processing your request PERIOD

Tuesday Thursday and Saturday

Wednesday Friday and Sunday





Robust news organizations like ours generate civic good that informs improves and inspires communities PERIOD For those invested in OU and Norman OU Daily uniquely has

 Free independent local journalism thats routinely honored at collegiate state and national levels

 The citys largest reporting staff largely drawn from one of the nations top journalism colleges

 A veteran advising staff with a mission to build on our legacy as a launching pad for media professionals

Whether in a onetime donation or a recurring pledge please 
CONTRIBUTE TO OUR MISSION PERIOD",OU football: Sooners take on Kansas State | Sports | oudaily.com,University of Oklahoma
