,date,content,title,name
8835,1970-01-01,"

TURLOCKWarriors baseball began their season against Western Oregon this weekend by loosing their first series of the season with a win Friday  and a doubleheader loss on Saturday   PERIOD

The series started off strong going into an extra inning with a standout performance from seniors second baseman Justin Charles as well as pitcher Bryan Lemon who received the win for Stanislaus PERIOD

Lemon had a strong performance pitching six and twothirds innings PERIOD Charles had a sacrifice fly two RBIs including the game winning RBI occurring in the bottom of the tenth inning and scored a run in the bottom of the third PERIOD

We came out energized and played good as a team and were excited to get the big win said Charles PERIOD

Both of the Saturdays games resulted in a loss for the Warriors PERIOD Though the Warriors suffered a loss in game two senior starting pitcher Rafael Vasquez pitched into the eighth inning only giving up one earned run and six hits while striking out five batters PERIOD Senior centerfielder Craig Beevers contributed with two hits PERIOD

The last game of the series started off shaky as the Warriors were down  until the bottom of the seventh inning when four runs were scored to tie up the game with the Wolves scoring the final run in the top of the ninth PERIOD Sophomore third baseman Skippy Ferreria juniors catcher Andrew Graves and shortstop Matt Chaidez each had a run in the bottom of the seventh PERIOD

Stanislauss next series is this weekend Friday at Fresno Pacific and Saturday at home with first pitch at 2p.m PERIOD









Log In

Keep it Clean PERIOD Please avoid obscene vulgar lewd
racist or sexuallyoriented language PERIOD
PLEASE TURN OFF YOUR CAPS LOCK PERIOD
Dont Threaten PERIOD Threats of harming another
person will not be tolerated PERIOD
Be Truthful PERIOD Dont knowingly lie about anyone
or anything PERIOD
Be Nice PERIOD No racism sexism or any sort of ism
that is degrading to another person PERIOD
Be Proactive PERIOD Use the Report link on
each comment to let us know of abusive posts PERIOD
Share with Us PERIOD Wed love to hear eyewitness
accounts the history behind an article PERIOD

The Signal csusignal  Instagram photos and videos

If youre interested in submitting a Letter to the Editor click here PERIOD

Your browser is out of date and potentially vulnerable to security risks.We recommend switching to one of the following browsers",Warrior baseball: team turns in solid performance despite loss | Sports | csusignal.com,CSU Stanislaus
