,date,content,title,name
4758,2015-12-17,"showers early then partly cloudy overnight PERIOD Low around 50F PERIOD Winds S at  to  mph PERIOD Chance of rain . pERIOD

Showers early then partly cloudy overnight PERIOD Low around 50F PERIOD Winds S at  to  mph PERIOD Chance of rain  PERIOD

Updated November     pm



The NCAA investigation involving Husky football coach Rick Neuheisel took another step as the University of Colorado responded to allegations of a  during Neuheisels term as head coach PERIOD

 said Dave Plati sports information director for Colorado PERIOD The university had until last Thursday to respond to the allegations and has no further comment on the investigation PERIOD

The next step is an official hearing in Philadelphia from August  to  when the NCAA will formally present its list of charges and Colorado will have a chance to present its case PERIOD Although the hearing lasts only three days the final decision wont come until about two months later PERIOD

While the UW isnt directly involved in the investigation the University might have to prove why Neuheisels duties as head coach should not be limited if he is deemed irresponsible PERIOD The UW has no comment on the investigation an athletic department spokesman said Monday PERIOD









Log In

Keep it Clean PERIOD Please avoid obscene vulgar lewd
racist or sexuallyoriented language PERIOD
PLEASE TURN OFF YOUR CAPS LOCK PERIOD
Dont Threaten PERIOD Threats of harming another
person will not be tolerated PERIOD
Be Truthful PERIOD Dont knowingly lie about anyone
or anything PERIOD
Be Nice PERIOD No racism sexism or any sort of ism
that is degrading to another person PERIOD
Be Proactive PERIOD Use the Report link on
each comment to let us know of abusive posts PERIOD
Share with Us PERIOD Wed love to hear eyewitness
accounts the history behind an article PERIOD

Your browser is out of date and potentially vulnerable to security risks.We recommend switching to one of the following browsers

Get uptotheminute news sent straight to your device PERIOD



Subscribe to our weekly newsletters covering the news arts and sports PERIOD

Serving the UW community since  PERIOD",Colorado responds to NCAA investigation | Local Sports | dailyuw.com,University of Washington
