,date,content,title,name
4461,2023-11-02,"the VCU Police Department was alerted early this morning about a dispute near campus that could have involved a weapon PERIOD Two people were involved in the incident near the  block of West Marshall Street PERIOD Shortly before  a.m PERIOD today a man reported to the Richmond Police Department that another man had threatened to shoot him after a dispute PERIOD

Mark Robinson Executive Editor The  school year brings a swath of changes for The Commonwealth Times PERIOD The CT will no longer publish twice a 

The CT strives for accuracy PERIOD If you believe we have made an error please contact Gabriela de Camargo Gonalves PERIOD

Letters to the editor or editorial content submissions are encouraged by email toKofi Mframa PERIOD

All content   The Commonwealth Times PERIOD No part of The Commonwealth Times may be reproduced in any form without written permission from the publisher PERIOD All rights reserved PERIOD

Copyright    WordPress Theme by MH Themes",update Archives - The Commonwealth Times,Virginia Commonwealth University
