,date,content,title,name
667,1970-01-01,"advertisement

I have not always agreed with things Kris Ankarlo has said over the years PERIOD That being said I must say he does my transfer trash heart proud after reading his column  Feb PERIOD  PERIOD Whether it be from finances family situations or whatever the fact that you can still work for a Penn State education and take care of other needs should be a source of pride for the university  not a source of ridicule against those who do not have daddys wallet to take care of things PERIOD

I hope people feel that saying youre from Abington or DuBois or New Kensington is a great source of pride PERIOD You are not alone PERIOD You are not some second rate students PERIOD You are Penn State PERIOD

If youre interested in submitting a Letter to the Editor click here PERIOD

Were always interested in hearing about news in our community PERIOD Let us know whats going on

Following a close game against Indiana The  Podcast cohosts Zach Allen and Seth Engle discuss the latest news on Penn State football PERIOD

Success An email has been sent to  with a link to confirm list signup PERIOD

Error There was an error processing your request PERIOD

Going through the highlights of the Penn State and State College news so you dont have to.Sign up todaySent every Thursday PERIOD

Get weekend previews and weekend recaps from The Daily Collegian Sports staff sent to your inbox PERIOD Sent every Friday and Monday PERIOD

Your browser is out of date and potentially vulnerable to security risks.We recommend switching to one of the following browsers",Different campus start doesn't hurt PSU unity  | Archived News | Daily Collegian | psucollegian.com,Pennsylvania State University
