,date,content,title,name
9251,2023-11-04,"considerable cloudiness PERIOD Low 41F PERIOD Winds light and variable. pERIOD

Considerable cloudiness PERIOD Low 41F PERIOD Winds light and variable PERIOD

Updated November     pm





South Koreas Ryu Haeran fired a fiveunder par  to win the NW Arkansas Championship for her first LPGA title

South Korean rookie Ryu Haeran won her first LPGA title on Sunday making four birdies and an eagle on the back nine Sunday to capture the NW Arkansas Championship PERIOD

The 22yearold from Seoul fought off the challenge from a host of rivals and overcame struggles at the start to fire a fiveunder par  PERIOD

That was good enough to finish the 54hole event on 19under  and defeat Swedens Linnea Strom by three strokes at Pinnacle Country Club in Rogers Arkansas PERIOD

 Ryu said PERIOD 

South Koreans Kim Seiyoung and Jenny Shin Japanese rookie Yuna Nishimura and Filipino Bianca Pagdanganan shared third on  with Australian Hannah Green another stroke adrift PERIOD

Overnight leader Ryu opened with a birdie but made bogeys at the par5 second and par4 fifth holes and found herself in a trophy fight as she made the turn two off the pace PERIOD

 Ryu said PERIOD But after the ninth hole I refocus for my iron distance PERIOD I tried more to bring my swing and made so many birdies and I got it. ryu birdied the tenth and twelfth then dropped her 7iron approach inches from the hole at the par5 fourteenth to set up a tapin eagle PERIOD She followed with birdies at  and  to seal the triumph PERIOD

World number  Ryu became the fifth LPGA rookie champion this year a tour record and only the second LPGA wiretowire winner this season after Brooke Henderson at the Tournament of Champions PERIOD

Ryu a fivetime Korean LPGA tour winner and LPGA Qschool medalist had five previous top10 finishes this year including eighth at the US Womens Open at Pebble Beach PERIOD

Strom charged late going fourunder in the last five holes to shoot  as did Bianca who eagled  and  in shooting sixunder  on the back nine PERIOD

Kim shot  but stumbled with a bogey at  while Shin made bogeys at  and  in firing a  for her best finish of the season PERIOD

Nishimura opened and closed the back nine with birdies in a bogeyfree  for her best LPGA result in  starts sharing third nudging ahead of her fourthplace showing in last years Japan Classic PERIOD

jsbb

Originally published on doc.afp.com part of the BLOX Digital Content Exchange PERIOD









Log In

Keep it Clean PERIOD Please avoid obscene vulgar lewd
racist or sexuallyoriented language PERIOD
PLEASE TURN OFF YOUR CAPS LOCK PERIOD
Dont Threaten PERIOD Threats of harming another
person will not be tolerated PERIOD
Be Truthful PERIOD Dont knowingly lie about anyone
or anything PERIOD
Be Nice PERIOD No racism sexism or any sort of ism
that is degrading to another person PERIOD
Be Proactive PERIOD Use the Report link on
each comment to let us know of abusive posts PERIOD
Share with Us PERIOD Wed love to hear eyewitness
accounts the history behind an article PERIOD

Your browser is out of date and potentially vulnerable to security risks.We recommend switching to one of the following browsers",South Korean rookie Ryu captures LPGA NW Arkansas title | National | thepenn.org,Indiana University of Pennsylvania
