,date,content,title,name
6678,2023-11-03,"the Michigan Daily

One hundred and thirtythree years of editorial freedom

DALLAS AP  Business trips and vacations were disrupted for tens of thousands of travelers yesterday as American Airlines canceled more than  flights  nearly half its schedule  to fix faulty wiring that could cause a shortcircuit or even a fire and explosion PERIOD

It was the latest  and largest  in a wave of cancellations at major U.S PERIOD airlines that have caused long lines at ticket counters and made flying even more stressful than usual PERIOD

Executives at American said safety was never compromised and they suggested the nations biggest airline was the victim of suddenly steppedup scrutiny by federal regulators PERIOD





Please consider donating to The Michigan Daily

Your email address will not be published PERIOD Required fields are marked 

Comment 

Name 

Email 

Website

Save my name email and website in this browser for the next time I comment PERIOD







See the results

Play the latest crossword

Stanford Lipsey Student Publications Building

 Maynard St Ann Arbor MI 

Edited and managed by the students at the University of Michigan since","American cancels 1,000-plus flights",University of Michigan
