,date,content,title,name
1507,2023-10-26,"news

Angola Prison Rodeo The last vestige of gladiators

News

Wildfire smoke affects air quality

News

Tulane SSI organizes empty Shabbat table service

Multimedia

BREAKING WAVES PODCAST  Episode  Beyond the Banners

Views

OPINION  Be wary of TikToks political influence

Arcade

Taylor Swifts  is back in Style following rerelease

Views

OPINION  Schools Protect your Jewish students

Arcade

Black Pumas sophomore album delivers on contemporary soul

Arcade

Haunting soon in theaters near you

Arcade

Inside the first allBlack production of Macbeth

News

Campus Cats organization keeps cats feline good

Football

Tulane gains road win with  victory at Rice

News

Students call for support amid ongoing Israel Palestine tensions

Letter to the Editor

Letter to the Editor  Why I grabbed the flag

City

ProPalestine proIsrael protestors clash at Tulane

On Wednesday Feb PERIOD  The Woldenberg Art Center concluded its latest exhibition Where We Are Tulane Contemporary. an exhibit with a thematic approach to nostalgia and the subconscious PERIOD Created.. PERIOD

Letter to the Editor  Why I grabbed the flag

Beyoncs Renaissance World Tour comes to Superdome

ProPalestine proIsrael protestors clash at Tulane

Student arrested after proPalestine graffiti appears on Freret TUPD says

Tulane condemns Hamas amid student grief and outcry

The Tulane Hullabaloo with Tulane Truckers

March  

Student newspaper serving Tulane University Uptown New Orleans",Anthony Baab Archives • The Tulane Hullabaloo,Tulane University
