,date,content,title,name
1174,2023-07-11,"uNF student died in traffic accident over weekend university confirms

One person shot near UNF campus alert says

Gallery Activists rally for Palestine in Jacksonville

 Jacksonville activists decry U.S PERIOD support of Israel

ProPalestine proIsrael protesters clash at student walkout Wednesday

Jacob Justice Sports Editor

November  

Jeanne Gilbert News Editor

November  

Carter Mudgett Editor in Chief

November  

Ethan Howick Sports Reporter

October  

Jacob Justice Sports Editor

October  

Childhood is the enjoyable stage in ones life when hoarding a collection of soft stuffed animals is viewed as the norm PERIOD As adulthood approaches teenagers are expected to keep only one or two plushes from their childhood PERIOD If maturity robbed you of your right to beanie babies teddy bears or farm animals Campus Life can repair some damage PERIOD

Ospreys get to stuff a cuddly plush animal during Summer As Twisted Tuesday on May  at  p.m PERIOD The event is free for students as long as they bring their student IDs with them to Osprey Plaza PERIOD

The compact plush eight inches is perfect for traveling with or modeling in front of bed pillows PERIOD For those planning on taking back their right to plush animals be sure to get to Osprey Plaza early PERIOD Campus Life has a limited amount of plushes to stuff PERIOD

Campus Life hosted Tuesdays with a Twist weekly last semester to encourage creativity on campus PERIOD Campus Life will only be hosting two Twisted Tuesdays during the summer  one during Summer A and one during Summer B PERIOD Past activities includedcreating sand art vases and customizing an overthedoor basketball hoop PERIOD

Students can visit UNF Campus Lifes Facebook page for more information on this event PERIOD



For more information or news tips or if you see an error in this story or have any compliments or concerns contactemailprotected PERIOD

UNFs  StudentRun News Source

Cancel reply

You must be logged in to post a comment PERIOD",Students can begin to regrow their stuffed animal empire with Summer A’s Twisted Tuesday - UNF Spinnaker,University of North Florida
