,date,content,title,name
7748,2023-11-05,"chains gravel and  feet of altitude gain summarized the journey to Trinidad Colorado for Jonathan King chair of health professions Rubn Dupertuis school of arts and humanities dean and Harry.. PERIOD

An interesting concept couldnt save No One Will Save You     Views

Libra season Your October horoscope     Views

The Fall of the House of Usher takes Poe to another level     Views

Let the savior complex go the real impacts of mission trips     Views

No ethical consumption is no justification for spending     Views

Trinitonian

The Student News Site of Trinity University",harry wallace – Trinitonian,Trinity University
