,date,content,title,name
2714,2023-11-04,"kathryn Kelly is the CEO and founder of The Heights Foundation an organization that works to build strong sufficient families in the Harlem Heights neighborhood in Fort Myers Florida PERIOD

Many families.. PERIOD

Ricardo Rivera a Music Education major with a Vocal Concentration at FGCU prepared  songs in five different languages for his junior recital on February thirteenth PERIOD He paid an accompanist  and prepared.. PERIOD

Within the last few weeks social media posts from FGCU students have circulated urging women to be alert after cars were keyed with Xs in FGCU student housing parking lots PERIOD Students are fearful from the.. PERIOD

By Katie Fogarty
Contributing Writer
FGCU issued free optional COVID19 saliva PCR tests for students and staff to take before leaving for winter break according to fgcu.educoronaupdate PERIOD
The Winter.. PERIOD

The Diverging Diamond Intersection Why its Coming to Fort Myers     Views

From MTV to FGCU John Lack Shares His Journalism Experience     Views

FGCUs Beach Club Makes a Splash This Semester     Views

UPD Beat Police Receive Complaint About a Student Playing Manhunt     Views

Upcoming Fall Activities to Do in Fort Myers     Views",Katie Fogarty – Eagle Media,Florida Gulf Coast University
