,date,content,title,name
9847,2017-02-28,"wHAT HAPPENED  Lewis  Clark College the second best small liberal arts college in Portland Oregon is in debt PERIOD Several reasons caused this unfortunate situation for 







Established in  we are Lewis  Clark Colleges awardwinning studentrun newspaper PERIOD By employing the highest standards of ethics integrity and transparency we produce stories that inform and challenge the Palatine Hill community PERIOD

The Mossy Log holds weekly staff meetings every Monday at  p.m PERIOD in J PERIOD R PERIOD Howard Rm PERIOD  PERIOD Staff meetings are open to all members of the Lewis  Clark community PERIOD Come and hear pitches for articles and visuals and connect with The Mossy Logs editorial board PERIOD

Are you interested in supporting student journalism at Lewis  Clark Consider donating to The Mossy Log by visiting this link PERIOD

Copyright    WordPress Theme by MH Themes",lc debt - The Mossy Log,Lewis and Clark College
