,date,content,title,name
4429,2023-11-01,"alan Rodriguez Espinoza Contributing Writer Many of us praise Twitter and Facebook for connecting us with people of similar political opinions PERIOD We see social medias 

VCUs School of Pharmacy has received a  million grant to continue research into genetic markers in human DNA that may predict chronic depression PERIOD

The CT strives for accuracy PERIOD If you believe we have made an error please contact Gabriela de Camargo Gonalves PERIOD

Letters to the editor or editorial content submissions are encouraged by email toKofi Mframa PERIOD

All content   The Commonwealth Times PERIOD No part of The Commonwealth Times may be reproduced in any form without written permission from the publisher PERIOD All rights reserved PERIOD

Copyright    WordPress Theme by MH Themes",personalized Archives - The Commonwealth Times,Virginia Commonwealth University
