,date,content,title,name
3147,2023-11-04,"you cant have a taco without a tortilla PERIOD The tortilla holds everything together and is the structural indicator of a taco PERIOD One could argue that the tortilla is the actual essence of a taco PERIOD The two.. PERIOD

Football stars bond conditions modified after two violations

Stop Lubbocks abortion travel ban

Smile you are on camera lawbreaker

Celebrating National Cat Day

A Swifties analysis of  Taylors Version

Independent Student Newspaper for the University of Texas at San Antonio",johnny hernandez - The Paisano,University of Texas San Antonio
