,date,content,title,name
1492,2023-10-26,"news

Angola Prison Rodeo The last vestige of gladiators

News

Wildfire smoke affects air quality

News

Tulane SSI organizes empty Shabbat table service

Multimedia

BREAKING WAVES PODCAST  Episode  Beyond the Banners

Views

OPINION  Be wary of TikToks political influence

Arcade

Taylor Swifts  is back in Style following rerelease

Views

OPINION  Schools Protect your Jewish students

Arcade

Black Pumas sophomore album delivers on contemporary soul

Arcade

Haunting soon in theaters near you

Arcade

Inside the first allBlack production of Macbeth

News

Campus Cats organization keeps cats feline good

Football

Tulane gains road win with  victory at Rice

News

Students call for support amid ongoing Israel Palestine tensions

Letter to the Editor

Letter to the Editor  Why I grabbed the flag

City

ProPalestine proIsrael protestors clash at Tulane

The Addams Family might not have left its mark on every household yet the theme song to the show is so popular that those who have never heard of the iconic family still know the tune PERIOD The Addams.. PERIOD

Beyoncs Renaissance World Tour comes to Superdome

Letter to the Editor  Why I grabbed the flag

ProPalestine proIsrael protestors clash at Tulane

Student arrested after proPalestine graffiti appears on Freret TUPD says

Tulane condemns Hamas amid student grief and outcry

The Tulane Hullabaloo with Tulane Truckers

March  

Student newspaper serving Tulane University Uptown New Orleans",jenna ortega Archives • The Tulane Hullabaloo,Tulane University
