,date,content,title,name
4257,2015-09-26,"

The Arcade  Miniboss from TheArcadeKLSU on 8tracks Radio PERIOD

Arcade   Quicksave from TheArcadeKLSU on 8tracks Radio PERIOD

DJ Miniboss has a Mega Man special bringing favorite songs from Mega Man  and X16 PERIOD DJ Quicksave brings more epic soundtracks from Monster Hunter Shovel Knight and more PERIOD

 PERIOD Elec Man Yoshihiro Sakaguchi PERIOD Manami Matsumae Mega Man

 PERIOD Guts Man Yoshihiro Sakaguchi PERIOD Manami Matsumae Mega Man

 PERIOD Woodman Stage Capcom Mega Man 

 PERIOD Metalman Stage Capcom Mega Man 

 PERIOD Mega Man  The Locker Room OC ReMix YamaYama httpocremix.org

 PERIOD Air Man Mega Man  The OneUps Volume 

 PERIOD Shadow Man RushJet1 Mega Man  Remade

 PERIOD Snake Man Capcom Mega Man 

 PERIOD Gemini Doc RushJet1 Mega Man  Remade

 PERIOD My Kind of Blues Mega Man  AES World  Encore

 PERIOD Pharaoh Man Capcom Mega Man 

 PERIOD Wily Stage  Capcom Mega Man 

 PERIOD StarMan Mari Yamaguchi Mega Man 

 PERIOD ChargeMan Mari Yamaguchi Mega Man 

 PERIOD Flameman Stage Yuko Takehara Mega Man 

 PERIOD SPLASH BLUE SPLASH WOMAN STAGE III Rockman 

 PERIOD WERE THE ROBOTS DR PERIOD WILY STAGE  III Rockman 

 PERIOD Freeze Penguin Setuo Yamamoto Makoto Tomozawa Yuki Iwai Yuko Takehara Toshihiko Horiyama Mega Man X

 PERIOD Mega Man X  Spark Mandrill Smooth McGroove Smooth McGroove VGM Acapella

 PERIOD Boomer Kuwanger Mega Man X The OneUps Volume 

 PERIOD Dangerous Reef Yuki Iwai Mega Man X2

 PERIOD Neon Tiger Stage Minakuchi Engineering Staff Toshihiko Horiyama Syusaku Uchiyama Yoshino Aoki Makoto Tomozawa Mega Man X3

 PERIOD Gravity Beetle StageMinakuchi Engineering Staff Toshihiko Horiyama Syusaku Uchiyama Yoshino Aoki Makoto Tomozawa Mega Man X3

 PERIOD Opening Stage X Toshihiko Horiyama Mega Man X4

 PERIOD Rush to Sky Lagoon Stage Select  Mega Man X4 Mega Flare Maverick

 PERIOD Boss Naoto Tanaka Naoya Kamisaka Takuya Miyawaki Mega Man X5

Your browser is out of date and potentially vulnerable to security risks.We recommend switching to one of the following browsers",The Arcade 9/26/2015 | KLSU | lsureveille.com,Louisiana College
