,date,content,title,name
5672,2023-11-04,"partly cloudy skies PERIOD Low 36F PERIOD Winds light and variable. pERIOD

Partly cloudy skies PERIOD Low 36F PERIOD Winds light and variable PERIOD

Updated November     pm



Wait Before you go sign up for The Quad our enewsletter to get JMU news delivered to your inbox PERIOD

Success An email has been sent to  with a link to confirm list signup PERIOD

Error There was an error processing your request PERIOD

Mary Lou Retton the Olympic gold medalwinning gymnast who appeared on Season  of Dancing With the Stars has been hospitalized and is in the ICU with a rare form of pneumonia PERIOD

The news was shared by Rettons daughter McKenna Kelley who posted a link to a crowdfunding website on her Instagram which revealed that her mother has a very rare form of pneumonia and is fighting for her life. she is not able to breathe on her own PERIOD Shes been in the ICU for over a week now PERIOD Out of respect for her and her privacy I will not disclose all details PERIOD However I will disclose that she not insured Kelley wrote on the fund raising page PERIOD

DWTS pro Sasha Farber who competed alongside Retton on Season  provided an update on Tuesday October  revealing that hed spoken with the Olympic gymnast earlier in the day PERIOD

ABCYouTube

Ive been talking to her today and shes fighting Farber told ETOnline PERIOD She kind of wants to give up but Im sending her videos of her dancing and Im telling her Theres only one Mary Lou Retton PERIOD Youve got this

Farber and Retton were the fifth couple eliminated in the  season but have remained friends ever since PERIOD

She was in LA a few weeks ago and she wanted to meet up but I had rehearsals and I couldnt Farber stated PERIOD She was like Let me take you out for dinner and I couldnt go because I had rehearsals PERIOD But I just mean youve got to see the people you care about youve gotta say hi you gotta call them PERIOD And Ive been speaking to her today. retton is best known for winning the gold medal in the individual allaround gymnastics competition at the  Summer Olympics in Los Angeles PERIOD She retired from the sport in  and was inducted into the International Gymnastics Hall of Fame in  PERIOD

Dancing with the Stars Tuesdays 87c ABC and Disney



More Headlines

Originally published on tvinsider.com part of the BLOX Digital Content Exchange PERIOD

Success An email has been sent to  with a link to confirm list signup PERIOD

Error There was an error processing your request PERIOD

The latest JMU news delivered to your inbox on Mondays and Thursdays PERIOD

Want to praise someone or get something off your chest  Darts and Pats is the place to do it PERIOD

The latest headlines from The Breeze delivered twice a week to your email inbox PERIOD

Success An email has been sent to  with a link to confirm list signup PERIOD

Error There was an error processing your request PERIOD

Your browser is out of date and potentially vulnerable to security risks.We recommend switching to one of the following browsers","Olympian Mary Lou Retton ‘Fighting for Life’ in ICU, ‘DWTS’ Partner Sasha Farber Shares Update | Entertainment | breezejmu.org",James Madison University
