,date,content,title,name
1675,2022-04-05,"as of the time of me writing this article I quit smoking cigarettes close to a month ago and I have never felt better PERIOD However I had serious issues with the physical and mental withdrawals from the.. PERIOD

Ecigarette pods and juice has become the new teenage epidemic and Juul Labs has taken action because of it PERIOD Vaping seems to have taken over the threat of the traditional tobacco products such as cigarettes.. PERIOD

This poll has ended PERIOD

Are you going Trick or Treating

Sorry there was an error loading this poll PERIOD

The student news site of Eastern Illinois University in Charleston Illinois PERIOD",juul – The Daily Eastern News,Eastern Illinois University
