,date,content,title,name
533,1970-01-01,"advertisement

Penn State Hillel won the Phillip H PERIOD Cohen and Susan Rudd Cohen Campus of Excellence Award which honors local Hillels and their achievements in empowering student leadership engagement and education according to a press release issued by Hillel PERIOD

The award is granted to a large campus group each year PERIOD Penn State Hillel is a group dedicated to fostering cohesion for more than  Jewish students that attend the university PERIOD

Aaron Kaufman Hillel Executive Director said he was thrilled that the group got national recognition and it is an incredible dynamic for Jewish life at Penn State PERIOD

The national office its been impressed with our student leadership PERIOD Students control everything PERIOD Its a studentcentered institution Kaufman said PERIOD

Besides winning for student leadership Jenna Heffler Hillels presidentelect said Hillel won the award because they have a strong board and staff PERIOD

We are very passionate responsible mature of what we do and thats who we are so thats definitely how we run a successful organization Heffler junioractuarial science said PERIOD I hope we get the award next year and no doubt that we will she said PERIOD

Usually each Hillel applies to be considered for the award but this year the group did not apply PERIOD They were surprised that they won Kaufman said PERIOD

Hillel has been at Penn State since the 1930s but in the last five years they have grown dramatically Kaufman said PERIOD

A few years ago the events had  attendees but now they have almost  students attending Hillel events PERIOD

Hillels goal is to support and foster Jewish life for the Penn State community and provide support for students to find their own identity said Ryan Gianola seniorhotel restaurant institutional management Hillels outgoing president PERIOD He hopes that Hillel becomes more prominent PERIOD

The award was given at a ceremony in Baltimore at the  Jewish Federations of North America General Assembly PERIOD Johns Hopkins Hillel also won the Campus of Excellence Award PERIOD

If youre interested in submitting a Letter to the Editor click here PERIOD

Were always interested in hearing about news in our community PERIOD Let us know whats going on

Following a close game against Indiana The  Podcast cohosts Zach Allen and Seth Engle discuss the latest news on Penn State football PERIOD

Success An email has been sent to  with a link to confirm list signup PERIOD

Error There was an error processing your request PERIOD

Going through the highlights of the Penn State and State College news so you dont have to.Sign up todaySent every Thursday PERIOD

Get weekend previews and weekend recaps from The Daily Collegian Sports staff sent to your inbox PERIOD Sent every Friday and Monday PERIOD

Your browser is out of date and potentially vulnerable to security risks.We recommend switching to one of the following browsers",PSU Hillel wins national award  | Archived News | Daily Collegian | psucollegian.com,Pennsylvania State University
