,date,content,title,name
8052,2023-11-04,"generally clear skies PERIOD Low 42F PERIOD Winds light and variable. pERIOD

Generally clear skies PERIOD Low 42F PERIOD Winds light and variable PERIOD

Updated November     pm



On an average day on the beaches of Kauais North Shore in Hawaii the water is a deep mesmerizing blue and majestic waves enrapture surfers beneath clear skies PERIOD The setting is nothing but tranquil PERIOD

However on Oct PERIOD   13yearold Bethany Hamilton was attacked by a 14foot tiger shark in this serene setting and her life was changed forever PERIOD

Almost  years since the incident Hamilton now a 23yearold surfer and role model has experienced more in her life than many in their late 70s have faced PERIOD Despite losing her left arm to the shark attack Hamilton astonishingly returned to the waters after only onemonth in recovery to chase her dreams of one day becoming a professional surfer PERIOD

As stated in her official website Hamilton said her inspiration for getting back on the surfboard after her attack stemmed from her zeal for surfing and she was not terrified of the water as much as she was afraid she would not be able to practice the sport anymore PERIOD

I think my motivation came from my passion for the sport for the ocean and from the hope that my lifestyle would not have to dramatically change she said PERIOD I was more scared that I wouldnt be able to surf again causing my life to turn upside down. mississippi State Universitys Dorothy Garrett Martin Lectureship in Values and Ethics will present Hamilton as this years guest speaker to share her inspirational story PERIOD The lectureship sponsored by MSUs Delta Gamma sorority is Wednesday at  p.m PERIOD in the Humphrey Coliseum PERIOD









Log In

Keep it Clean PERIOD Please avoid obscene vulgar lewd
racist or sexuallyoriented language PERIOD
PLEASE TURN OFF YOUR CAPS LOCK PERIOD
Dont Threaten PERIOD Threats of harming another
person will not be tolerated PERIOD
Be Truthful PERIOD Dont knowingly lie about anyone
or anything PERIOD
Be Nice PERIOD No racism sexism or any sort of ism
that is degrading to another person PERIOD
Be Proactive PERIOD Use the Report link on
each comment to let us know of abusive posts PERIOD
Share with Us PERIOD Wed love to hear eyewitness
accounts the history behind an article PERIOD

These are the most popular articles of the week PERIOD

Sorry there are no recent results for popular videos PERIOD",SOUL SURFER: Bethany Hamilton shares testimony  of triumph | News | reflector-online.com,Mississippi State University
