,date,content,title,name
7509,2023-11-05,"claremont Colleges News

When directives to clear the campuses cancel events and suspend most onsite activity were issued in March many 5C students scattered for home or alternate residences PERIOD But departing students left behind a vastly different landscape for the handful of their classmates that remained at the colleges PERIOD

With one week of remote classes under their belts 5C professors and students are coming to terms with the ups and downs of online instruction PERIOD

After Pomona College sent most students away in the face of the coronavirus pandemic about  students remain on campus as of Friday PERIOD

Following the 5Cs decision to eliminate inperson classes  athletic departments suspended the remainder of the spring sports season PERIOD

Pomona College is planning a slew of changes to its firstyear orientation programming designed to increase awareness of campus resources PERIOD

Pomona College is shortening its Orientation Adventure by a day and a half and adding LAbased options which wont require wilderness travel PERIOD

As the Wuhan coronavirus continues to spread globally more 5C students studying abroad are seeing their programs suddenly canceled PERIOD

The David Horowitz Freedom Center will sue Pomona and Pitzer Colleges for alleged antiSemitism citing Trumps new executive order PERIOD

Pomona will keep next falls Orientation Adventure destinations within four hours driving distance from campus PERIOD

Claremont residents opposed a proposal to dissolve the citys police department and contract with the L.A PERIOD County sheriff instead PERIOD

Email Address



Subscribe to our weekly newsletter delivered every Friday at  a.m PERIOD PDT PERIOD

Email Address



The Student Life is the oldest college newspaper in Southern California serving the Claremont Colleges since  PERIOD

Contact us at editortsl.news PERIOD","Erika Schwerdfeger, Author at The Student Life",Claremont Colleges - Claremont McKenna
