,date,content,title,name
3522,2023-11-04,"mostly clear PERIOD Low near 35F PERIOD Winds light and variable. pERIOD

Mostly clear PERIOD Low near 35F PERIOD Winds light and variable PERIOD

Updated November     pm



During his farewell speech Tuesday night in Chicago Obama joked You can tell that Im a lame duck because no ones following instructions. although he was clearly just making a joke the statements Obama made during his farewell speech throughout the night were clearly contradictory with Trumps campaign promises PERIOD Obamas speech covered many topics including immigration climate change Muslims and his health care law PERIOD

If every economic issue is framed as a struggle between a hardworking white middle class and undeserving minorities then workers of all shades will be left fighting for scraps while the wealthy withdraw further into their private enclave. although that statement can be interpreted many different ways it is clearlycontradictoryto Trumps lifestyle and campaign platform PERIOD Obama also indirectly called out the Republican Party stating thatif anyone can put together a plan that is demonstrably better than the improvements weve made to our health care system  that covers as many people at less cost  I will publicly support it. although many of his statements in his farewell address werent particularly pointed at Trumps presidency his executive order in December clearly was PERIOD His orderrequired that the President of the United States be a federal taxpayer even though he encouraged peoplenot to read too much into the timing of his executive order it was quite a statement PERIOD









Log In

Keep it Clean PERIOD Please avoid obscene vulgar lewd
racist or sexuallyoriented language PERIOD
PLEASE TURN OFF YOUR CAPS LOCK PERIOD
Dont Threaten PERIOD Threats of harming another
person will not be tolerated PERIOD
Be Truthful PERIOD Dont knowingly lie about anyone
or anything PERIOD
Be Nice PERIOD No racism sexism or any sort of ism
that is degrading to another person PERIOD
Be Proactive PERIOD Use the Report link on
each comment to let us know of abusive posts PERIOD
Share with Us PERIOD Wed love to hear eyewitness
accounts the history behind an article PERIOD

Success An email has been sent to  with a link to confirm list signup PERIOD

Error There was an error processing your request PERIOD

Have the latest local news delivered right to your mailbox twice weekly every Tuesday and Friday PERIOD

Your browser is out of date and potentially vulnerable to security risks.We recommend switching to one of the following browsers",Obama's not a lame duck | Opinions | purdueexponent.org,Purdue University
