,date,content,title,name
6040,2023-04-25,"a free and responsible press serving the UMass community since 

Le yogaa une longue histoire PERIOD mergeant il y a plusieurs milliers dannes en Inde il est aujourdhui pratiqu partout dans le monde PERIOD Aux tatsUnis seulement  des gens ont au moins entendu parler du yoga PERIOD Des cours de yoga sont mme proposs complexe sportif de lUniversit du Massachusetts PERIOD Il est de notorit publique que la pratique du yoga a des bnfices physiologiques et mentaux mais en quoi consistentils 

La flexibilit

Lavantage sans doute le plus souvent attribu  la pratique du yoga est une flexibilit accrue PERIOD Sans surprise cela est vrifi par des tudes PERIOD Ces deuxarticles publis par PubMed appuient cette affirmation PERIOD Ils affirment que ceux qui pratiquent le yoga deux  trois heures par semaine pendant plusieurs semaines le nombre exact varie taient plus souples que ceux qui ne le pratiquent pas PERIOD La flexibilit prsente galement dautres avantages tels que la rduction des risques de blessure PERIOD Une tude publie dans lAmerican Journal of Sports Medicine a test la flexibilit de  athltes fminines dans des universits et a mis en vidence une corrlation entre manque de flexibilit et apparition de blessures PERIOD

Conscience du corps

Le yoga cre la conscience du corps une qualit essentielle PERIOD La dfinition exacte de la conscience corporelle varie mais cest principalement le fait de savoir comment vous vous sentez physiquement et mentalement PERIOD Les personnes ayant une conscience du corps suprieure seraient mieux en mesure de se rendre compte sils sont stresss ou malades que ceux qui ont une conscience du corps moins leve PERIOD Une telle tudea t mene sur trois groupes de personnes  le premier pratiquant le yoga le suivant larobic et le dernier ni lun ni lautres PERIOD Ltude a montr que ceux qui pratiquent le yoga ont la conscience corporelle la plus leve de tous les groupes de ltude PERIOD

Il existe un autre avantage du yoga similaire  une conscience corporelle accrue la satisfaction du corps ce qui signifie que la perception de chacun envers son corps est favorable PERIOD Cela peut expliquer pourquoi une enqutemene par le Centre national de la sant complmentaire et intgrative auprs des yogis a montr que  dentre eux pratiquaient le yoga pour des  raisons lies au bientre  notamment la rduction du stress une motivation accrue et une assistance nutritionnelle PERIOD Le yoga a mme t utilis pour traiter des troubles de lalimentation PERIOD

Rduction du stress

Il est prouv que la pratique du yoga peut combattre un flau qui pse sur lexistence des tudiants  le stress PERIOD Pour beaucoup il est ncessaire de trouver un moyen de se relaxer pour supporter le travail scolaire et le yoga peut tre ce moyen PERIOD Le yoga rduitconsidrablement le stress PERIOD Le sondage mentionn prcdemment ralis par le Centre national de la sant complmentaire et intgrative a galement rvl que  des yogis ont dclar que la pratique du yoga rduisait leur stress PERIOD

Dans un article du Journal of Evidence Based Intregrative Medicine il a t dmontr que le yoga rduit les symptmes de la dpression PERIOD Le yoga peut aussi aider votre capacit  vous concentrer en raison de linclusion de la mdiation dans de nombreuses pratiques du yoga PERIOD Il a t dmontr que la mditation augmente la concentration chez les personnes qui la pratiquent PERIOD Cet effet peut tre mise en relation avec la dcouverte publie dans le Journal of American Osteopathic Association que les pratiques physiques de grouperduisent considrablement le stress PERIOD

Depuis le dbut du semestre jai russi  faire du yoga  la maison presque tous les jours PERIOD Un gros avantage de la pratique  la maison est la possibilit de crer vos propres horaires PERIOD Vous pouvez pratiquer aussi longtemps que vous le souhaitez et je me suis toujours senti mieux aprs un peu de yoga peu importe la dure de la sance PERIOD Personnellement je trouve que les pratiques de    minutes fonctionnent le mieux pour moi PERIOD Jai galement essay un cours de yoga au centre de loisirs et jai pass un excellent moment PERIOD Je recommanderais le cours plutt que la pratique  la maison en raison des avantages lis  la pratique en groupe de la dure et de la qualit de lentranement mais les horaires des cours de yoga proposs peuvent ne pas correspondre  votre emploi du temps PERIOD

Je trouve que laspect unique du yoga rside dans le fait quil peut sadapter  tout le monde PERIOD Il existe des varits de yoga pour les besoins de chacun certaines de haute intensit dautres plus mditatives PERIOD Alors droulez un tapis et commencez  vous entraner PERIOD Vous vous sentirez mieux PERIOD

Ben Connolly peut tre contact  emailprotected

Meg Beauregard est la traductrice pour la version franaise et peut tre contacte  emailprotected

Florent Charrier est lditeur de la version franaise et peut tre contact  emailprotected



Cancel reply

Your email address will not be published PERIOD Required fields are marked 

Comment 

Name 

Email",Trois bonnes raisons de s’essayer au yoga – Massachusetts Daily Collegian,University of Massachusetts Amherst
