,date,content,title,name
9263,2023-11-04,"considerable cloudiness PERIOD Low 41F PERIOD Winds light and variable. pERIOD

Considerable cloudiness PERIOD Low 41F PERIOD Winds light and variable PERIOD

Updated November     pm



Indiana University of Pennsylvania alumnus Don Swanson placed second in the eighth annual Manhattan Film Festival this summer with his film What Was Lost. swanson graduated from IUP in  with a communications media major and a theater minor and has made over a dozen  30minute short films since graduating PERIOD

Swansons film What Was Lost also won third place for best film at the Johnston Festival Sept PERIOD  PERIOD

Swanson is not the only IUP graduate connected with his film PERIOD

My executive producer of What Was Lost was the star of the film Swanson said PERIOD His name is John Patrick Driscoll PERIOD He graduated from IUP in  and is now a working actor in New York. swansons first two films were created during his career at IUP PERIOD In  his professional career sparked PERIOD

In  I attended my first festival the Westchester Film Festival where I presented my short film Suddenly Shay Swanson said PERIOD

While Swanson mostly works as an independent filmmaker his team of actors is fairly well known PERIOD

IUP alumna Jennifer Warren  an actress on American Horror Story Coven playing Kathy Bates daughter  will be starring in Swansons next film Erson which is to be completed in  according to Swanson PERIOD









Log In

Keep it Clean PERIOD Please avoid obscene vulgar lewd
racist or sexuallyoriented language PERIOD
PLEASE TURN OFF YOUR CAPS LOCK PERIOD
Dont Threaten PERIOD Threats of harming another
person will not be tolerated PERIOD
Be Truthful PERIOD Dont knowingly lie about anyone
or anything PERIOD
Be Nice PERIOD No racism sexism or any sort of ism
that is degrading to another person PERIOD
Be Proactive PERIOD Use the Report link on
each comment to let us know of abusive posts PERIOD
Share with Us PERIOD Wed love to hear eyewitness
accounts the history behind an article PERIOD

Your browser is out of date and potentially vulnerable to security risks.We recommend switching to one of the following browsers",Alumnus placed second in NYC film fetival | News | thepenn.org,Indiana University of Pennsylvania
