,date,content,title,name
5691,2008-09-25,"partly cloudy skies PERIOD Low 36F PERIOD Winds light and variable. pERIOD

Partly cloudy skies PERIOD Low 36F PERIOD Winds light and variable PERIOD

Updated November     pm



Wait Before you go sign up for The Quad our enewsletter to get JMU news delivered to your inbox PERIOD

Success An email has been sent to  with a link to confirm list signup PERIOD

Error There was an error processing your request PERIOD

September  









Success An email has been sent to  with a link to confirm list signup PERIOD

Error There was an error processing your request PERIOD

The latest JMU news delivered to your inbox on Mondays and Thursdays PERIOD

Want to praise someone or get something off your chest  Darts and Pats is the place to do it PERIOD

The latest headlines from The Breeze delivered twice a week to your email inbox PERIOD

Success An email has been sent to  with a link to confirm list signup PERIOD

Error There was an error processing your request PERIOD

Your browser is out of date and potentially vulnerable to security risks.We recommend switching to one of the following browsers",Puzzles  |  | breezejmu.org,James Madison University
