,date,content,title,name
9905,2023-11-04,"sacred Heart Universitys Official Student Newspaper

By Bryan Brown Staff Reporter Over the years there has been more than a fair share of video games to dominate the gaming world PERIOD

Enter your email address to subscribe to The Spectrum and receive notifications of new posts by email PERIOD

Email Address

Subscribe

The Spectrum is a studentrun weekly newspaper publication first established in  PERIOD The staff consists of nearly  editors and more than two dozen staff writers and contributing writers PERIOD The writing staff is fueled by News Writing and Reporting Classes in which students learn the fundamentals of news writing while being published weekly in the Spectrum PERIOD
Please contact spectrumsacredheart.edu with any questions PERIOD",Brendan Burke Archives – The Spectrum Newspaper,Sacred Heart University
