,date,content,title,name
4372,2023-11-04,"wSU researchers are working to meet high current demands for fish and seafood by using aquaculture which could supplement existing sources that come from fishing PERIOD

The research group  comprised of.. PERIOD

WSU researchers received a grant to develop a new viruskilling technology against COVID19. the Trailblazer Award from the National Institute of Health and National Institute of Biomedical Engineering.. PERIOD







Social Media Policy

The Office of Student Media

The purpose of the comment section is to foster courteous and constructive discussion of relevant issues PERIOD The Daily Evergreen staff reserve the right to delete any comment we deem at odds with that mission PERIOD

We want to establish a fair and open forum for discussion but personal attacks and threats of any kind actively take away from that purpose PERIOD Once we delete a comment we will explain both in the post and through a personal message to the sender as to why it didnt meet our standards PERIOD We will also add a link to our social media policy page on our website PERIOD We cannot allow comments that could possibly keep others from speaking their mind on our page PERIOD

Prohibited comments include

Comments with directed profanity bullying spam false or misleading statements
Comments that could cause physical and emotional harm to any person
Offensive language targeted toward a specific group of people
Comments that are offtopic
Comments that are racist sexist or bigoted
Comments by students working for The Office of Student Media unless authorized",CRISPR – The Daily Evergreen,Washington State University
