,date,content,title,name
1707,2022-04-05,"a man fleeing the police in a car chase through Charleston that led to a 5vehicle wreck is dead according to the Illinois State Police PERIOD

He was pronounced dead at a hospital following the wreck PERIOD

The.. PERIOD

This poll has ended PERIOD

Are you going Trick or Treating

Sorry there was an error loading this poll PERIOD

The student news site of Eastern Illinois University in Charleston Illinois PERIOD",charleston crime – The Daily Eastern News,Eastern Illinois University
