,date,content,title,name
8620,1970-01-01,"







Former NC State baseball standout Chris Combs passed away Thursday morning after a fiveyear battle with ALS PERIOD He was  years old PERIOD

The power hitterpitcher had his No PERIOD  honored by NC State baseball earlier this year not only for his dominating presence on the field but for his strong and inspiring courage off the diamond PERIOD No PERIOD  hangs on the wall under the scoreboard in rightcenter field PERIOD

Combs and his wife Gena founded Team Chris Combs with the goal to find a cure for Lou Gehrigs disease and have raised more than  million for research so far PERIOD

In his senior season Combs was a SecondTeam AllACC selection and was drafted in the fifth round of the MLB draft by the Pittsburgh Pirates PERIOD After his playing days he worked as an associate director for the Wolfpack Club for  years PERIOD

Combs is currently tied for fifth alltime in career home runs  and tenth in RBIs  PERIOD

Current NC State baseball head coach Elliott Avent coached Combs in his senior year in  PERIOD

 Avent told NC State Athletics PERIOD His legacy is cemented on the outfield wall where he so gracefully roamed the outfield for the Wolfpack from  PERIOD However his lasting legacy is that he will be remembered not only for how he played and lived but the dignity pride and courage that was constantly on display for these last fourandahalf years PERIOD











Log In

Keep it Clean PERIOD Please avoid obscene vulgar lewd
racist or sexuallyoriented language PERIOD
PLEASE TURN OFF YOUR CAPS LOCK PERIOD
Dont Threaten PERIOD Threats of harming another
person will not be tolerated PERIOD
Be Truthful PERIOD Dont knowingly lie about anyone
or anything PERIOD
Be Nice PERIOD No racism sexism or any sort of ism
that is degrading to another person PERIOD
Be Proactive PERIOD Use the Report link on
each comment to let us know of abusive posts PERIOD
Share with Us PERIOD Wed love to hear eyewitness
accounts the history behind an article PERIOD

Success An email has been sent to  with a link to confirm list signup PERIOD

Error There was an error processing your request PERIOD

Top Technician stories delivered to your inbox each Thursday

Your browser is out of date and potentially vulnerable to security risks.We recommend switching to one of the following browsers",NC State baseball legend Chris Combs passes away from ALS | Sports | technicianonline.com,North Carolina State University
