,date,content,title,name
4401,2023-11-01,"noah Fleischman Sports Editor On the outside of their hands just under the pinky finger is a tattooed acronym TG4L. the phrase is more than 

Noah Fleischman Sports Editor The Robert E PERIOD Lee monument and Marcus David Peters Circle have become a gathering point for many during Richmond protests against 

Noah Fleischman Sports Editor Jamal Brunt sat in the RandolphMacon basketball office stuffing envelope after envelope packing recruiting letters and other written materials the athletic 

Mens Basketball made quick work of Iona Saturday in advance of a seasondefining stretch in which the Rams will play at No PERIOD  Texas and 

NoahFleischman Staff Writer Fifteenyear coaching veteran Jamal Brunt joined the Mens Basketball coaching staff in the offseason after three seasons at Miami PERIOD This season will 

The CT strives for accuracy PERIOD If you believe we have made an error please contact Gabriela de Camargo Gonalves PERIOD

Letters to the editor or editorial content submissions are encouraged by email toKofi Mframa PERIOD

All content   The Commonwealth Times PERIOD No part of The Commonwealth Times may be reproduced in any form without written permission from the publisher PERIOD All rights reserved PERIOD

Copyright    WordPress Theme by MH Themes",Jamal Brunt Archives - The Commonwealth Times,Virginia Commonwealth University
