,date,content,title,name
8478,2023-11-04,"clear to partly cloudy PERIOD Low 41F PERIOD Winds ESE at  to  mph. pERIOD

Clear to partly cloudy PERIOD Low 41F PERIOD Winds ESE at  to  mph PERIOD

Updated November     pm



Oct PERIOD 

Jorge Jose Britez Aveiro reported the theft of his bicycle at WAW Library PERIOD Officer also provided escort for victim PERIOD

Officer assisted Emporia Police Dept PERIOD with a suspicious person call at  Highland PERIOD

Resident Assistant in Twin Towers Complex reported a mouse in a room in South Twin Towers first floor PERIOD Officer was unable to locate the rodent PERIOD

Oct PERIOD 

Resident Assistant in Twin Towers Complex reported a power outage in Trusler Hall Room  PERIOD HBO PERIOD

Oct PERIOD 

Officer stopped KS983KZL at twelfth and Highland PERIOD Citation for expired tags past  days PERIOD

Officer assisted Emporia Police Dept PERIOD with Car StopDUI at Logan and Commercial PERIOD

Oct PERIOD 

Maire Johnson requested welfare check for student at  W twelfth PERIOD HBO PERIOD

Officers engaged in community contact with subjects in Union Square PERIOD

Male student requested to speak with an officer at ESU PD HQ

Officer retrieved an animal from  Triplett Dr PERIOD Apt PERIOD  PERIOD Animal taken to the animal shelter PERIOD

Officer engaged in community contact at seventh and Commercial with a potential fall PERIOD

A male faculty member requested to speak to an officer in Sector  PERIOD Officer took a report of criminal damage to KS 811FNF PERIOD

Officer responded to a Blue Light Emergency telephone call at eighteenth and Morse Dr PERIOD No problem was found PERIOD

Oct PERIOD 

Officer provided escort for KS personalized tag TURKEY1 from  Commercial to the Memorial Union PERIOD

Officer assisted Emporia Police Dept PERIOD with an arrest at twelfth and Merchant PERIOD

Officer assisted Emporia Police Dept.with a shots fired call at ninth and Sylvan PERIOD

Officer assisted Emporia Police Dept PERIOD with minor in consumption at  Exchange PERIOD

Officer assisted Emporia Police Dept PERIOD with an intoxicated person at eleventh and Commercial PERIOD

Ambulance responded to North Twin Tower sixth floor restroom for vomiting and intoxicated PERIOD Subject was transported by ambulance to Newman Regional Health PERIOD

Oct PERIOD 

Officer stopped KS VIN 1FTSS34P66HA78465 on I35 southbound at mm  PERIOD Citation for expired drivers license and no license plate PERIOD

Officer assisted Emporia Police Dept PERIOD with a child lock out at  Cottonwood PERIOD

Officer provided escort for a female student from Sector  to Singular Hall PERIOD Starting mileage . ending mileage . pERIOD

Officer assisted Emporia Police Dept PERIOD with traffic control for Honor Flight escort at fifteenth and Industrial Rd PERIOD

Oct PERIOD 

Officer assisted Emporia Police Dept PERIOD with a car stop at sixth and Merchant PERIOD

Officer checked the welfare of a female student in Sector  PERIOD HBO PERIOD

Oct PERIOD 

Officer provided escort for a male and female student from the Memorial Union to Lot  PERIOD

Officer contacted subject at  Whittier and advised it was illegal to burn within city limits PERIOD









Log In

Keep it Clean PERIOD Please avoid obscene vulgar lewd
racist or sexuallyoriented language PERIOD
PLEASE TURN OFF YOUR CAPS LOCK PERIOD
Dont Threaten PERIOD Threats of harming another
person will not be tolerated PERIOD
Be Truthful PERIOD Dont knowingly lie about anyone
or anything PERIOD
Be Nice PERIOD No racism sexism or any sort of ism
that is degrading to another person PERIOD
Be Proactive PERIOD Use the Report link on
each comment to let us know of abusive posts PERIOD
Share with Us PERIOD Wed love to hear eyewitness
accounts the history behind an article PERIOD

Sorry there are no recent results for popular videos PERIOD

Sorry there are no recent results for popular commented articles PERIOD

Your browser is out of date and potentially vulnerable to security risks.We recommend switching to one of the following browsers",Police Logs 10/23-10/30 | News | esubulletin.com,Emporia State University
