,date,content,title,name
9192,2021-03-13,"the College Reporter

The independent student newspaper of Franklin  Marshall College

By Florian Direny  Contributing Writer In an increasingly virtual world and with the rapid rise of online communication people are becoming less and less engaged in inperson interactions PERIOD A

The College Reporter

The independent student newspaper of Franklin  Marshall College

Proudly powered by WordPress								
  
								Theme Newsup by Themeansar PERIOD",Florian Direny - The College Reporter,Franklin and Marshall College
