,date,content,title,name
4663,2018-12-17,"meet Duckie Duckie is a grey tuxedo who loves belly rubs treats and his little brother Birdie PERIOD Duckuie can play fetch with his toys and his 





Former Sports Editor

May   The Flying WV makes an appearance on the PNC Park scoreboard just before West Virginias game with Penn State

The West Virginia University baseball team will head up to Pittsburgh to play traditional rival Penn State at PNC Park PERIOD

The Mountaineers  cruised to a  win over the Nittany Lions last season at the major league ballpark behind the impressive pitching prowess of Sam Kessler Cody Wood and Braden Zarbnisky PERIOD

The Backyard Brawl meeting at Monongalia County Ballpark was originally scheduled for March  but was postponed due to inclement weather PERIOD WVU beat Pitt  in last seasons home finale behind the bat of Kyle Davis PERIOD

SEASON OVERVIEW

Penn StateThe Nittany Lions hold a  record and have been struggling to find the win column as of late PERIOD After sweeping Elon in the opening weekend of the season PSU has only won four games two of which were against lowly NJIT PERIOD On average Penn State is outscored by about three runs per game PERIOD

PittPitt has been one of the most surprising teams of the ACC holding a  record PERIOD After being swept in their first two conference series against Virginia Tech and North Carolina the Panthers picked up an upset win against thenNo PERIOD  Duke at home and are coming off two consecutive ACC series wins against Virginia and Boston College PERIOD Pitt is  in nonconference play losing only to Saint Louis and Seton Hall both of which are in the RPI top  PERIOD

Starters WVU vs PERIOD PSUPITT

Tuesday Jackson Wolf  . eRA vs PERIOD Eric Mock  . eRA

Wednesday TBD vs PERIOD Dan Hammer  . eRA

Game schedule

WVU vs PERIOD Penn State PNC Park Tuesday at  p.m PERIOD Radio

Pitt at WVU Wednesday at  p.m PERIOD Video Radio

Former Sports Editor





Want to report a sports score or pass on some sports news Use this form PERIOD







The Daily Athenaeum began in  and remains the independent student voice of West Virginia University PERIOD All content is produced by students funded by student fees advertising and generous donations by readers like yourself PERIOD Your gift goes directly to supporting our students and powers our experiential newsroom PERIOD

Your browser is out of date and potentially vulnerable to security risks.We recommend switching to one of the following browsers",WVU Baseball Preview: Penn State and Pitt | Sports | thedaonline.com,West Virginia University
