,date,content,title,name
6327,2023-11-04,"sports

Chico State mens soccer ends regular season with a tie

News

Over  raised for victims in Gaza at Palestine vigil

News

Financial analysis of CSU reveals strong financial status

The Big Dipper

Chico State proposes new deadly Lotteryinspired parking solution

Arts  Entertainment

Kappa Sigma wins annual Chili Cook Off

A oneday event will try bringing relief to Butte County homeless PERIOD

On April  the Silver Dollar Fairgrounds will host Project Homeless Connect an event that includes volunteers and community organizations coming together to bring hundreds of free and necessary services to the Butte County homeless population PERIOD

The goal of this event is to help solve some of the issues that prevent homeless people from getting off the streets PERIOD

Some of the services provided on this day are medical and dental check ups mental health services haircuts and grooming housing applications veteran services clothing and valid California IDs for use in applying for jobs and housing PERIOD

Amelia Storm can be reached at emailprotected or ameliastorm on Twitter

Chico States independent student newspaper

Cancel reply

Your email address will not be published PERIOD Required fields are marked 

Comment 

Name 

Email",Project homeless connect returns to chico – The Orion,CSU Chico
