,date,content,title,name
4272,1970-01-01,"



The LSU Student Health Center on  Infirmary Drive Baton Rouge on Monday Jan PERIOD   PERIOD

LSUs Student Health Center has confirmed several student cases of mumps which was communicated to students and faculty in a Division of Strategic Communications email on Tuesday PERIOD

Mumps is a contagious disease spread by contactwith infectious respiratory tract secretions and saliva PERIOD

Students with swollen and tender salivary glands under the ears or jaw on one or both sides of the face should seek care at the Student Health Center or with their primary care provider PERIOD Students with signs of mumps must be kept in isolation for at least five days from the onset of salivary gland swelling PERIOD

While there is no specific treatment for mumps most people recover fully PERIOD However mumps can occasionallycause serious complications according to the Student Health Center PERIOD

The Student Health Center recommends good hand washing not eating or drinking after others and covering ones nose and mouth with a tissue when coughing or sneezing to help prevent transmission of the disease PERIOD

Receiving two doses of the measles mumps and rubella MMR vaccine is the best way to prevent pumps PERIOD This vaccine is currently required for all students at the University PERIOD Most students on campus should be protected due to the vaccine according to the Student Health Center but the vaccine is not  effective PERIOD

Anyone who has not received two doses of the MMR vaccine is recommended to get the vaccine as soon as possible PERIOD A third MMR vaccine is recommended for anyone who has come into contact with someone currently diagnosed with mumps PERIOD

The Student Health Center is open from  a.m PERIOD to  p.m PERIOD on Mondays through Fridays and from  a.m PERIOD to noon on Saturdays PERIOD Students can receive the MMR vaccine free of charge at the Student Health Center Injection Clinic which is open Monday through Thursday from  a.m PERIOD to  a.m PERIOD and  p.m PERIOD to  p.m PERIOD and Friday from  a.m PERIOD to  a.m PERIOD

Click here for more information on mumps PERIOD

Updated Feb PERIOD   p.m PERIOD The number of mumps cases has increased from five on Feb PERIOD  to  as of Feb PERIOD  PERIOD This article has been updated to r

If youre interested in submitting a Letter to the Editor click here PERIOD

Got a question Want to share an anonymous news tip Click  to let the Reveilles student journalists know PERIOD

Your browser is out of date and potentially vulnerable to security risks.We recommend switching to one of the following browsers",LSU Student Health Center confirms several student cases of mumps | News | lsureveille.com,Louisiana College
