,date,content,title,name
8371,2023-11-04,"students and faculty who walked through the Student Union on April  were delighted with a nice surprise free ice cream  well kind of PERIOD

The Zips Programming Network hosted the makeshift ice cream.. PERIOD

Susie Frazier closing her retail showroom in Cleveland after twelve years     Views

Applications open for Akrons  Alternative Spring Break     Views

A birthday gift from Zippy     Views

The Editorially Independent Voice of The University of Akron",equality - The Buchtelite,University of Akron
