,date,content,title,name
4622,2023-10-30,"car stolen near campus housing found in Posey County     Views

Students express safety concerns following vehicle thefts on campus     Views

Opinion Influx of new talent will transform mens basketball team     Views

Geometry Dash still holds up as one of the best platformers of the past decade     Views

fifty-fourth Annual Juried Student Art Exhibition displays students exhibitions for academic year     Views

ComedySportz touched down at USI Tuesday night PERIOD

The improv show came down from Indianapolis thanks to USIs Activity Programming Board APB who hosted the event PERIOD

The show has two teams that compete games against each other taking suggestions from the crowd PERIOD A referee mediates between the teams PERIOD



Junior physics and Spanish major Sam Barnett volunteered to give sound effects for an act the blue team put on PERIOD

The act became known as the fart hands and won the audience over for the blue team PERIOD

Barnett said even though the crowd was small they participated PERIOD

We had a good group come out tonight Barnett said PERIOD I think everyone had a good time. he said his favorite part of the show was clap clap Todd. crowd favorite Todd had members last year clap twice before anyone said his name PERIOD The game carried over to this years show PERIOD

Sophomore advertising major Micah Red Elk saw the ComedySportz show during Spring  and always clapped for Todd PERIOD

The show was really funny he said PERIOD

Red Elk said he liked the game where the audience picked five different activities PERIOD For example the ComedySportz team had to act out playing hacky sack with the Motly Crue and the hacky sack was Nicki Minajs head PERIOD Red team member Claire entered the game without knowledge of what the activity was and shehad to guess what her teammates were acting out PERIOD Her partner gave clues through actions and jibber talk no actual words allowed PERIOD

The audience scored the teams on whichever one they favored the most PERIOD Fouls were called on the red team PERIOD

Crowd favorite and red team member Toddlet a curse word escape from his lips frustrated that he couldnt think of a When I was your age line PERIOD

Audience members decided to call the brownbag foul. a brownbag foul is when a team member or even an audience member says something inappropriate  ComedySportz is for all ages PERIOD The naughty person  in this case Todd  has to keep a brown bag over his head for the rest of the act or scene PERIOD

ComedySportz member Chad Woodward approached the stage as The Voice the host PERIOD

He said ComedySportz has loved USIs audience PERIOD

You guys have a great audience one that remembers us he said PERIOD

The games that are played on any show are general games he said PERIOD

Everything is made up on the spot  with suggestions from the audience Woodward said PERIOD It changes up the game every time. this year is Woodwards fifth year at ComedySportz in Indianapolis and coming this February ComedySportz approaches its twentieth year PERIOD

ComedySportz puts on shows every Thursday Friday and Saturday   for adults PERIOD

University of Southern Indianas student publication  USI  student newspaper",ComedySportz: Students participate with improv show – The Shield,University of Southern Indiana
