,date,content,title,name
3528,2023-11-04,"mostly clear PERIOD Low near 35F PERIOD Winds light and variable. pERIOD

Mostly clear PERIOD Low near 35F PERIOD Winds light and variable PERIOD

Updated November     pm



Indiana residents are buckling up in record numbers following the implementation of the Click It or Ticket program PERIOD

Observational field surveys conducted after the May start date of the public awareness program show that . percent of all drivers and passengers in the state wear seat belts PERIOD

Over the summer Gov PERIOD Mitch Daniels approved a law which strengthened seat belt usage requirements PERIOD It requires all occupants of vehicles to be buckled in regardless of seating position and the vehicle type PERIOD

As compared to  numbers compliance has increased by . percent PERIOD

The study analyzed by the Indiana Criminal Justice Institute also shows more women buckling up than men PERIOD More than  percent of women wear seat belts as compared to  percent of men PERIOD

 said Mike Cunegin executive director of the state agency PERIOD 









Log In

Keep it Clean PERIOD Please avoid obscene vulgar lewd
racist or sexuallyoriented language PERIOD
PLEASE TURN OFF YOUR CAPS LOCK PERIOD
Dont Threaten PERIOD Threats of harming another
person will not be tolerated PERIOD
Be Truthful PERIOD Dont knowingly lie about anyone
or anything PERIOD
Be Nice PERIOD No racism sexism or any sort of ism
that is degrading to another person PERIOD
Be Proactive PERIOD Use the Report link on
each comment to let us know of abusive posts PERIOD
Share with Us PERIOD Wed love to hear eyewitness
accounts the history behind an article PERIOD

Success An email has been sent to  with a link to confirm list signup PERIOD

Error There was an error processing your request PERIOD

Have the latest local news delivered right to your mailbox twice weekly every Tuesday and Friday PERIOD

If youre interested in submitting a Letter to the Editor click here PERIOD

Sorry there are no recent results for popular commented articles PERIOD

Your browser is out of date and potentially vulnerable to security risks.We recommend switching to one of the following browsers",Program results in record compliance  | City | purdueexponent.org,Purdue University
