,date,content,title,name
621,1970-01-01,"advertisement

NEW YORK 

Clemson running back C.J PERIOD Spiller rode in his limo with Barry Sanders PERIOD Sanders answered with Spiller when asked about the top running backs in this years draft class PERIOD

Sanders really likes Oklahoma State offensive tackle Russell Okung but admitted he was biased because of his alma mater  also Oklahoma State PERIOD He laughed and said he was glad he didnt have to make the choice between Okung and Nebraska tackle Ndamukong Suh PERIOD

Tennessee safety Eric Berry said Tim Tebow was  hes ever taken PERIOD

Ndamukong Suh said he was nervous but relaxed and spent some of the afternoon playing video games with the other guys invited to the draft PERIOD

Suh rode in the car to the draft with legendary Giants linebacker Lawrence Taylor but wouldnt share the advice Taylor gave him PERIOD

NFL commissioner Roger Goodell said the goal of moving the draft to primetime on Thursday night was to get more people talking about the NFL and football as a whole PERIOD

AJC

If youre interested in submitting a Letter to the Editor click here PERIOD

Were always interested in hearing about news in our community PERIOD Let us know whats going on

Following a close game against Indiana The  Podcast cohosts Zach Allen and Seth Engle discuss the latest news on Penn State football PERIOD

Success An email has been sent to  with a link to confirm list signup PERIOD

Error There was an error processing your request PERIOD

Going through the highlights of the Penn State and State College news so you dont have to.Sign up todaySent every Thursday PERIOD

Get weekend previews and weekend recaps from The Daily Collegian Sports staff sent to your inbox PERIOD Sent every Friday and Monday PERIOD

Your browser is out of date and potentially vulnerable to security risks.We recommend switching to one of the following browsers",NFL Draft red carpet tidbits  | Archived News | Daily Collegian | psucollegian.com,Pennsylvania State University
