,date,content,title,name
4639,2023-10-30,"in this postelection season I feel we have forgotten something very important PERIOD

We have forgotten Thanksgiving we have forgotten to be thankful PERIOD I remember growing up my mother had my siblings and.. PERIOD

Car stolen near campus housing found in Posey County     Views

Students express safety concerns following vehicle thefts on campus     Views

Opinion Influx of new talent will transform mens basketball team     Views

Geometry Dash still holds up as one of the best platformers of the past decade     Views

fifty-fourth Annual Juried Student Art Exhibition displays students exhibitions for academic year     Views

University of Southern Indianas student publication  USI  student newspaper",Good Medicine – The Shield,University of Southern Indiana
