,date,content,title,name
7178,2023-11-04,"partly cloudy skies PERIOD Low 53F PERIOD Winds light and variable. pERIOD

Partly cloudy skies PERIOD Low 53F PERIOD Winds light and variable PERIOD

Updated November     pm



China is expected to overtake the United States economy before the year  according to a new intelligence assessment of global trend PERIOD However it is projected the U.S PERIOD will still be a global powerhouse because of its energy independence PERIOD

Additionally the assessment projected a larger global middle class that will be better educated have better access to health insurance for the future and more people with Internet access according to a New York Times report PERIOD

Still the report predicts terrorism will still be prevalent and half of the worlds population will be living in areas that will suffer from fresh water shortages PERIOD

Moreover the study found countries such as Brazil Colombia India Indonesia Nigeria South Africa and Turkey are going to be impactful on the worlds economy as well PERIOD

Sorry there are no recent results for popular commented articles PERIOD

Your browser is out of date and potentially vulnerable to security risks.We recommend switching to one of the following browsers",China poised to pull ahead | News | dailytitan.com,CSU Fullerton
