,date,content,title,name
5623,1970-01-01,"

George Strait and special guest Clay Walker will perform at 

p.m PERIOD Saturday March  at the ThompsonBoling Arena PERIOD Strait with

eight certified platinum albums and over a dozen certified gold is

definitely a man in the top of his field PERIOD His latest album Easy Come

Easy Go continues his tradition of classic country and strong

songwriting PERIOD

Something of a country Renaissance man Strait doesnt confine himself to

one form of expression PERIOD Besides playing both guitar and piano he is active

in steerroping a member of the Professional Rodeo Cowboys Association

hunting fishing and golf PERIOD

He has also had success in film with the critically acclaimed Pure

Country PERIOD While many musiciantoactor crossovers are instantly

regrettable Straits performance was strong and honest PERIOD Playing a country

singer who gives up the limelight to return home and work on a ranch

Strait was able to handle a horse as well as he handles music PERIOD

Strait began his career in  growing from innovator to standardbearer PERIOD

His simple and clean hatjeansdress shirt look caught on with the

glitzjaded country music fans and helped take the genre refreshingly back

to its roots PERIOD The success of his style is evident not only in his

platinumselling albums but in the two dozen awards he has received over

the past  years PERIOD

Easy Come Easy Go features tunes written by some outstanding

Nashville songwriters PERIOD Dean Dillon and Aaron Barker longtime

collaborators with Strait return with the melancholy  and the tearjerker  On the truly

classic country side the album also features George Jones  and

 which was cowritten by Faron

Young PERIOD

Saturdays show should be a great time for country music fans PERIOD









Log In

Keep it Clean PERIOD Please avoid obscene vulgar lewd
racist or sexuallyoriented language PERIOD
PLEASE TURN OFF YOUR CAPS LOCK PERIOD
Dont Threaten PERIOD Threats of harming another
person will not be tolerated PERIOD
Be Truthful PERIOD Dont knowingly lie about anyone
or anything PERIOD
Be Nice PERIOD No racism sexism or any sort of ism
that is degrading to another person PERIOD
Be Proactive PERIOD Use the Report link on
each comment to let us know of abusive posts PERIOD
Share with Us PERIOD Wed love to hear eyewitness
accounts the history behind an article PERIOD

Campus and local news delivered to your desktop daily PERIOD

Email Address

By submitting this form you are granting The Daily Beacon permission to email you PERIOD You may unsubscribe via the link found at the bottom of every email PERIOD See our Email Privacy Policy for details. emails are serviced by Constant Contact PERIOD

Tennessee football took down UConn  on Saturday moving to  on the season PERIOD

Your browser is out of date and potentially vulnerable to security risks.We recommend switching to one of the following browsers",Strait bringing traditional style to Thompson-Boling | Entertainment | utdailybeacon.com,"University of Tennessee, Knoxville"
