,date,content,title,name
2706,2023-11-04,"dONATEHERE
Food insecurity is defined as the state of or risk of being unable to provide food for yourself PERIOD Unbelievably people in the United States experience food insecurity every day PERIOD As of .. PERIOD

The Diverging Diamond Intersection Why its Coming to Fort Myers     Views

From MTV to FGCU John Lack Shares His Journalism Experience     Views

FGCUs Beach Club Makes a Splash This Semester     Views

UPD Beat Police Receive Complaint About a Student Playing Manhunt     Views

Upcoming Fall Activities to Do in Fort Myers     Views",hunger walk – Eagle Media,Florida Gulf Coast University
