,date,content,title,name
7946,2021-03-13,"with the first home football game of the season right around the corner the SGA and other campus organizations are looking for ways to keep more students in their seats PERIOD

Looking up and seeing the student section in the upper bowl of BryantDenny Stadium only partially filled has become a familiar sight over the past few seasons and while there are  seats in the student section attendance has never broken  according to a November  article in The Crimson White PERIOD

In  only . percent of student tickets were used PERIOD The University is trying to fight this trend by assigning tickets by upper or lower bowl ahead of time but it remains to be seen if the tide can be turned PERIOD

But sparse attendance is not the only problem plaguing the student section PERIOD With its new Stay for Four initiative the SGA is hoping to stop the steady stream of students that begins to file out come halftime leaving empty seats scattered across the student section by the end of the fourth quarter PERIOD

Leela Foley director of media relations for the SGA said they are hoping to do something about the bad image created by students leaving early PERIOD

SGA has designed the Stay for Four initiative to encourage students to stay for all four quarters of the football game Foley said PERIOD We get a lot of negative feedback when the student section empties out during halftime at games when Alabama is steadily in the lead. some students however feel that there just isnt any point to sitting through the rest of the game when the outcome seems to have been determined PERIOD

If the team is taking our first string players out we should take our first string fans out Mitchell Dykstra a junior majoring in philosophy said PERIOD If I wanted to watch Blake Sims run draw plays for the entire second half  I dont want to do that. as part of Stay for Four the SGA provides fans to help students cool off during long football games PERIOD

All students will receive a Stay for Four fan on their seat before the game this Saturday Foley said PERIOD These fans have the fight song lyrics printed on them so we hope students will use them throughout the game not only to cool off from the Alabama heat but also to sing along after touchdowns. the SGA will also offer other incentives for students to sit through the entire game PERIOD

We will also be randomly selecting a student who stays for all four quarters to be Fan of the Week Foley said PERIOD They will receive a prize package from the SUPe Store and will be featured on the SGA website and social media PERIOD We are hoping to develop the Fan of the Week initiative throughout the fall and at the end of the season this group would receive a tour of the football athletic facility. dykstra said that he would more likely to stay for all four quarters if there were incentives to do so PERIOD

Foley said the SGA is hoping to partner with the Office of First Year Experience and other student organizations on the Stay for Four initiative in the future PERIOD

We expect the program to evolve after each game and are open to suggestions and partnerships from other organizations Foley said PERIOD

Dykstra had a suggestion for how to get students to stay for the entire game PERIOD

Schedule better outofconference opponents PERIOD That would encourage me to stay Dykstra said PERIOD",Full stadium newest aim for SGA – The Crimson White,University of Alabama
