,date,content,title,name
2222,2022-03-16,"the Creative Writing Program hosted budding fiction author Karen Russell on Wednesday PERIOD She read from her new collection of short stories St PERIOD Lucys Home For Girls Raised By Wolves PERIOD

Russell has been featured recently in The New Yorkers debut fiction issues as well as New York magazines list of  people to watch under the age of  PERIOD She pursued her undergraduate studies at Northwestern University then completed a twoyear Masters degree in fine arts program at Columbia University PERIOD

Mark Slouka the head of the Creative Writing Program at the U of C introduced Russell saying She returns to us the vertiginous pleasure of imagining. russell read from the title story of her collection PERIOD It follows a pack of human girls who were raised by werewolf parents PERIOD The girls spent their childhood running wrestling snarling and hunting with the real wolves of the forest PERIOD The story begins with the rehabilitation of these girls from animals into humans PERIOD

After the reading the audience was invited to ask questions about her writing process and particularly about the transition from undergraduate to MFA student to published writer PERIOD

Russell said there are advantages to going to an MFA program PERIOD Almost all her stories from this collection were written at Columbia and revised over and over again in peer workshops PERIOD The MFA program also connected Russell with agents and editors interested in publishing her work PERIOD

I had to be proactive and tell myself that Im never going to write the perfect story so Im going to send my stories out now Russell said PERIOD

Slouka pointed out the differences between a Ph.D program and an MFA program PERIOD He said that coming from a Ph.D program he wrote like a critic and had to reteach himself how to write PERIOD

Reading and writing for two years is a joy Russell said of her MFA experience PERIOD But it was a crazy thing to do. its nice to know that my novel has a home already said Russell of her promised novel PERIOD  It feels like Ive sold them real estate that doesnt exist yet. russell said she would love to write more short stories but novels are more economically promising PERIOD

When asked if Russell has a fantasy life of doing something different and practical she said that she works in a veterinary center for that very reason but wouldnt give up writing for anything PERIOD

Even on a bad day I might have written the worst sentence in the world but its not like I killed a man she said PERIOD

Your donation will support the student journalists of University of Chicago PERIOD Your contributions go towards our annual website hosting costs and equipment costs PERIOD

Cancel reply

Your email address will not be published PERIOD Required fields are marked 

Comment 

Name 

Email",Author Karen Russell presents newest work – Chicago Maroon,University of Chicago
