,date,content,title,name
4964,1970-01-01,"

Sports editor

Redshirt senior infielderoutfielder Tanner Tredaway during the game against New Orleans on March  PERIOD

Oklahoma  will play Texas AM  at  p.m PERIOD on Wednesday in Omaha at the College World Series PERIOD

In a survive and advance game AggieBaseball powered their way to a  victory over Notre Dame.MCWS pic.twitter.com0ZMfKNb9wc

The Aggies making their first CWS appearance since  defeated Notre Dame on Tuesday PERIOD Texas AM is led by Nathan Dettmer who entering Tuesdays game had started  games and boasts a . eRA and  record PERIOD

Sunday the Sooners defeated Notre Dame  PERIOD OU is  this postseason PERIOD

Wednesdays game will air on ESPN PERIOD

Success An email has been sent to  with a link to confirm list signup PERIOD

Error There was an error processing your request PERIOD

Tuesday Thursday and Saturday

Wednesday Friday and Sunday

Sports editor





Robust news organizations like ours generate civic good that informs improves and inspires communities PERIOD For those invested in OU and Norman OU Daily uniquely has

 Free independent local journalism thats routinely honored at collegiate state and national levels

 The citys largest reporting staff largely drawn from one of the nations top journalism colleges

 A veteran advising staff with a mission to build on our legacy as a launching pad for media professionals

Whether in a onetime donation or a recurring pledge please 
CONTRIBUTE TO OUR MISSION PERIOD",College World Series: Oklahoma to play Texas A&M in game airing on ESPN | Sports | oudaily.com,University of Oklahoma
