,date,content,title,name
5887,2020-03-26,"posted By FIUSM Staff
March  

Image by Robert Trabucco courtesy of Creative Commons

Raul HerreraAssistant News Director

Its been a few months since FIU partnered up with Zoo Miami and now students can reap the benefits of this collaboration PERIOD

New internship opportunities with Zoo Miami are now available for FIU students PERIOD

According to an FIU Newsroom press release a memorandum of understanding was signed between FIU and Zoo Miami on July   establishing a partnership for the purpose of employing students with aspirations to participate in internship opportunities at the Miami Metro Zoo PERIOD The students to be employed are to come from College of Arts  Sciences and Chaplin School of Hospitality and Tourism Management PERIOD

Michael Heithaus executive director of the School of Environment Arts and Society said that the purpose of partnerships like this is to enhance student research. the hope is that these internships empower students through the knowledge and contacts gained to forge their future careers Heithaus said PERIOD

Provost Douglas Wartzok had said in the press release that the partnership brings together two worldclass institutions to help define a twenty-first century zoo as a locus for high quality research and conservation leadership. the press release also pointed out that the partnership is modeled after theWorld Association of Zoos and Aquariums conservation strategy which includes integration of the research community and the public consciousness to bring about scientific decisions for benefit of wildlife PERIOD

The partnership initiated a collaboration of lectures called the FIUZoo Miami lecture series PERIOD The next step is internships PERIOD

We just announced the first round of internship opportunities at the Zoo in a variety of areas. said Heithaus PERIOD We also hope to see more FIU classes taking advantage of the zoo as a great resource. heithaus said that these internships are available for both undergraduate and graduate students from either the College of Arts and Sciences or the Chaplin School of Hospitality and Management PERIOD

The internships are ongoing filled as needed by each area Heithaus said in a followup email to student media PERIOD The current plans are based on available resources and the needs of Zoo Miami. heithaus later mentioned that the internships will be unpaid but that the Zoo hopes to make these paid internships once the funds are available. one possibility that he cited was using research grants PERIOD He also said that interns can reapply once they finish an internship semester PERIOD

According to the aforementioned press release work is subject to begin immediately involving collective research initiatives in conjunction with internship opportunities PERIOD It also states that the memorandum of understanding is to result in the creation of many programs including Ph.D PERIOD projects public seminars on biodiversity and conservation and courses on zoo policy and management PERIOD

The Zoo and FIU are working together on a number of fronts PERIOD There will continue to be exciting research collaborations student opportunities and community events from the ZooFIU partnership Heithaus said PERIOD

Heithaus expressed his belief that this partnership will be a benefit to the university PERIOD

The internships give students the opportunity to gain handson knowledge and experience in areas such as horticulture restoration education and programming Heithaus said PERIOD

Students will also have the opportunity to get research experience by participating in one of the many joint research projects being conducted by FIU faculty and Zoo staff. bbcfiusm.com

Coronavirus Coverage Opinion Politics

Columns Sports

Campus Life News

Coronavirus Coverage Opinion Student Thoughts

Your email address will not be published PERIOD

Comment

Name 

Email 

Website





Your name

Your email

Subject

Your message optional



FIU Student Media includes PantherNOW Magazine and PantherNOW.com which are edited and produced by students at FIU PERIOD

We publish every Wednesday during the regular academic year PERIOD We also publish daily online content PERIOD

The Roar WRGP is the studentrun radio station which operates   on . in Miami . in North Miami and . in KendallHomestead area PERIOD

 FIU Student Media",New internships available to students with Zoo Miami - PantherNOW,Florida International University
