,date,content,title,name
5652,2023-11-04,"partly cloudy skies PERIOD Low 36F PERIOD Winds light and variable. pERIOD

Partly cloudy skies PERIOD Low 36F PERIOD Winds light and variable PERIOD

Updated November     pm





Wait Before you go sign up for The Quad our enewsletter to get JMU news delivered to your inbox PERIOD

Success An email has been sent to  with a link to confirm list signup PERIOD

Error There was an error processing your request PERIOD

Oct   Arlington Texas USA Chicago Bears wide receiver Dante Pettis  in action during the game between the Dallas Cowboys and the Chicago Bears at ATT Stadium PERIOD Mandatory Credit Jerome MironUSA TODAY Sports

Bears wide receiver Dante Pettis was placed on injured reserve Friday PERIOD

Pettis was vying for the fifth wide receiver job in Chicago and had been under consideration for the primary punt return role PERIOD He started seven games and played in all  with the team in  PERIOD

Pettis has played in  career games and spent his first four seasons in the NFL mostly with the New York Giants outside of five games with the San Francisco 49ers in that time PERIOD

The Bears also waived wide receiver Joe Reed with an injury designation PERIOD Reed played in  games for the Los Angeles Chargers in  PERIOD

Cincinnati Bengals defensive end Tarell Basham was waived PERIOD

The seventhyear pro signed with the Bengals in April but he missed most of training camp with a leg injury PERIOD

Sixthyear safety Dane Cruikshank was released by the New York Jets PERIOD

Cruikshank was a fifthround draft pick in  and appeared in  career games including four starts for the Titans and Bears PERIOD

Cruikshank signed with the Jets on July  PERIOD

The Houston Texans released veteran cornerback Darius Phillips waived offensive tackle Jacky Chen and signed punter Ty Zentner PERIOD

Houstons regular punter Cameron Johnston tweaked his calf muscle multiple reports said so the team needed to pick up a replacement for the preseason finale against the New Orleans Saints PERIOD Zentner an undrafted free agent out of Kansas State was waived by Philadelphia this month PERIOD

Phillips  spent last year with the Denver Broncos after his first four NFL seasons with the Bengals PERIOD He has five career interceptions and  tackles in  games  starts PERIOD

Field Level Media

Originally published on fieldlevelmedia.com part of the BLOX Digital Content Exchange PERIOD

Success An email has been sent to  with a link to confirm list signup PERIOD

Error There was an error processing your request PERIOD

The latest JMU news delivered to your inbox on Mondays and Thursdays PERIOD

Want to praise someone or get something off your chest  Darts and Pats is the place to do it PERIOD

The latest headlines from The Breeze delivered twice a week to your email inbox PERIOD

Success An email has been sent to  with a link to confirm list signup PERIOD

Error There was an error processing your request PERIOD

Your browser is out of date and potentially vulnerable to security risks.We recommend switching to one of the following browsers",Transaction roundup: Bears WR Dante Pettis placed on IR |  | breezejmu.org,James Madison University
