,date,content,title,name
5645,2023-10-04,"partly cloudy skies PERIOD Low 36F PERIOD Winds light and variable. pERIOD

Partly cloudy skies PERIOD Low 36F PERIOD Winds light and variable PERIOD

Updated November     pm



Wait Before you go sign up for The Quad our enewsletter to get JMU news delivered to your inbox PERIOD

Success An email has been sent to  with a link to confirm list signup PERIOD

Error There was an error processing your request PERIOD

FRIDAY Oct PERIOD   HealthDay News  A tentative deal has been reached between Kaiser Permanente and its  health care workers following a threeday strike last week PERIOD

 union officials posted Friday on X formerly known as Twitter PERIOD

 Kaiser Permanente said in an X post PERIOD

Health care workers who serve millions of Americans began the threeday strike after contract negotiations over staffing levels stalled PERIOD The union represents medical assistants surgical and lab technicians and pharmacists among other staffers PERIOD Along with staffing levels pay and benefits are an issue CNBC reported PERIOD

The strike targeted Kaiser hospitals and medical offices in California Colorado Oregon Virginia the District of Columbia and Washington state PERIOD Employees in Kaisers Georgia facilities were not affected PERIOD Kaiser Permanente serves nearly  million patients and operates  hospitals and more than  medical offices across the United States PERIOD

Kaiser generated  billion in revenue in the second quarter of  PERIOD It reported  billion in profit for the quarter up from a loss of . billion during same quarter in  CNBC reported PERIOD

CNBC Article

Originally published on consumer.healthday.com part of the BLOX Digital Content Exchange PERIOD

Success An email has been sent to  with a link to confirm list signup PERIOD

Error There was an error processing your request PERIOD

The latest JMU news delivered to your inbox on Mondays and Thursdays PERIOD

Want to praise someone or get something off your chest  Darts and Pats is the place to do it PERIOD

The latest headlines from The Breeze delivered twice a week to your email inbox PERIOD

Success An email has been sent to  with a link to confirm list signup PERIOD

Error There was an error processing your request PERIOD

Your browser is out of date and potentially vulnerable to security risks.We recommend switching to one of the following browsers","Kaiser Permanente Reaches Tentative Deal With 75,000 Health Care Workers | Health | breezejmu.org",James Madison University
