,date,content,title,name
4972,1970-01-01,"







Oklahoma freshman Jordan Bowers and fifthyear senior Carly Woodard garnered Big  weekly awards on Tuesday after bounceback victories against No PERIOD  Stanford No PERIOD  Utah State and Arizona in the Sooners third meet of the season PERIOD

For the second time this season jordansbowers and carlyw19 were both honored by the Big12Conference   httpst.cougGyCcEPzK

Bowers was named Big  Newcomer of the Week for the second time this season PERIOD Meanwhile Woodard was named Big  Event Specialist of the Week for the second time this season and the sixth time in her career PERIOD

Bowers earned her third consecutive weekly award after a . performance on vault in last weeks win PERIOD The Lincoln Nebraska native also notched a . on floor a . on bars and a careerhigh . in the allaround PERIOD

Woodard garnered Big  honors following her . on beam and . on floor in the quad meet on Saturday PERIOD Woodard posted a . and . on beam in the last two competitions PERIOD

No PERIOD  OU will next go headtohead against No PERIOD  Denver  at  p.m PERIOD on Sunday Jan PERIOD  in Norman ESPN PERIOD

Success An email has been sent to  with a link to confirm list signup PERIOD

Error There was an error processing your request PERIOD

Tuesday Thursday and Saturday

Wednesday Friday and Sunday





Robust news organizations like ours generate civic good that informs improves and inspires communities PERIOD For those invested in OU and Norman OU Daily uniquely has

 Free independent local journalism thats routinely honored at collegiate state and national levels

 The citys largest reporting staff largely drawn from one of the nations top journalism colleges

 A veteran advising staff with a mission to build on our legacy as a launching pad for media professionals

Whether in a onetime donation or a recurring pledge please 
CONTRIBUTE TO OUR MISSION PERIOD","OU women's gymnastics: Sooners' Jordan Bowers, Carly Woodard receive Big 12 weekly awards | Sports | oudaily.com",University of Oklahoma
