,date,content,title,name
7743,2023-11-04,"there are many reasons why students visit Counseling Services anxiety is often one of them PERIOD Students frequently come to me after having received a whole host of mixed messages PERIOD Most are aware of the rising.. PERIOD

An interesting concept couldnt save No One Will Save You     Views

Libra season Your October horoscope     Views

The Fall of the House of Usher takes Poe to another level     Views

No ethical consumption is no justification for spending     Views

Let the savior complex go the real impacts of mission trips     Views

Trinitonian

The Student News Site of Trinity University",lori kinkler – Trinitonian,Trinity University
