,date,content,title,name
713,1970-01-01,"in March Penn State student Amber Rupp received a grant from  Dots Downtown to repurpose old State College parking meters according to the State College Borough Parking Department PERIOD

With the grant Rupp seniormarketing in collaboration with the State College Borough Parking Department used old parking meters and turned them into art pieces and yearround coin donation collectors for THON PERIOD

Donations can also be made towards the meters and THON through ParkMobile the parking app used in the area PERIOD

Editors note Amber Rupp is a current representative of The Daily Collegians creative department PERIOD

MORE CAMPUS COVERAGE

Penn State Homecoming announced David Taylor will serve as this years Homecoming Grand Mars



If youre interested in submitting a Letter to the Editor click here PERIOD

From Tuesday to Thursday one travel lane on Easterly Parkway will be closed from  a.m PERIOD to  p.m. according to a release PERIOD

Hundreds of Penn State students braved the heat and flooded the HUBRobeson Center lawn Wednesday during the annual Involvement Fair PERIOD





Were always interested in hearing about news in our community PERIOD Let us know whats going on

Following a close game against Indiana The  Podcast cohosts Zach Allen and Seth Engle discuss the latest news on Penn State football PERIOD

Success An email has been sent to  with a link to confirm list signup PERIOD

Error There was an error processing your request PERIOD

Going through the highlights of the Penn State and State College news so you dont have to.Sign up todaySent every Thursday PERIOD

Get weekend previews and weekend recaps from The Daily Collegian Sports staff sent to your inbox PERIOD Sent every Friday and Monday PERIOD

If youre interested in submitting a Letter to the Editor click here PERIOD

Your browser is out of date and potentially vulnerable to security risks.We recommend switching to one of the following browsers",Penn State student turns parking meters into THON coin donation collectors | University Park Campus News | psucollegian.com,Pennsylvania State University
