,date,content,title,name
6672,2019-02-19,"the Michigan Daily

One hundred and thirtythree years of editorial freedom





She is Miss Philippines and she wears our flag PERIOD She works hard and grows rice PERIOD She is proudly Filipino and her name is Ms PERIOD Carabao PERIOD



Please consider donating to The Michigan Daily

Your email address will not be published PERIOD Required fields are marked 

Comment 

Name 

Email 

Website

Save my name email and website in this browser for the next time I comment PERIOD







See the results

Play the latest crossword

Stanford Lipsey Student Publications Building

 Maynard St Ann Arbor MI 

Edited and managed by the students at the University of Michigan since",Ms. Carabao,University of Michigan
