,date,content,title,name
4403,2023-11-04,"the VCU Board of Visitors senior vice president and chief financial officer Karol Gray met on Friday to discuss next years budget and state funding for the university PERIOD Photo by Enza Marcy

The CT strives for accuracy PERIOD If you believe we have made an error please contact Gabriela de Camargo Gonalves PERIOD

Letters to the editor or editorial content submissions are encouraged by email toKofi Mframa PERIOD

All content   The Commonwealth Times PERIOD No part of The Commonwealth Times may be reproduced in any form without written permission from the publisher PERIOD All rights reserved PERIOD

Copyright    WordPress Theme by MH Themes",20200221-EnzaMarcy-43 - The Commonwealth Times,Virginia Commonwealth University
