,date,content,title,name
92,1970-01-01,"select Page

by Nathan Rubin  Mar    A  E Film  

This review contains spoilers PERIOD You cross the hive you get stung PERIOD What would happen if a Twitter.. PERIOD

by Zimra Chickering  Jan    A  E Wheel  

I tend to see art as quite a broad category in my life even if that is simply the artistic.. PERIOD

by Ben Brodsky  Aug    A  E Wheel  

Beyonc released her highlyanticipated RENAISSANCE on July   a highenergy genrebending.. PERIOD

by Zimra Chickering  Apr    A  E  

Among the sins of the art world few are as awful as intentional exclusion and marginalization of.. PERIOD

by Yokie Abera  Mar    A  E  

When it comes to sisters Chloe and Halle Bailey numerous media outlets are quick to label them as.. PERIOD

by Cailen Chinn  Dec    A  E  

A few days ago I read a tweet referring to the eighth track of Megan Thee Stallions first.. PERIOD

by Jesse Weiner  Jul    A  E  

The dread hit me during the climactic battle of Jon Favreaus reheated The Lion King. an hour.. PERIOD

by Kamryn Olds  Jan    A  E  

James Blakes style permeates the zeitgeist of todays popular music PERIOD Beyonces Lemonade JayZs  and the Black Panther soundtrack are just a few albums to which the British singer songwriter and producer has.. PERIOD

by Jesse Weiner  Apr    A  E  

You look in the mirror but you dont like what you see PERIOD You scroll through Instagram but all you.. PERIOD

by Abdul Bingahlan  Sep    A  E  

Four years PERIOD It has been over four years since Frank Ocean captured the hearts of fans with his.. PERIOD

by Avery Yang  Aug    A  E  

Blew up and Im in the A still. drake adlibbed that line original line Blew up and Im in.. PERIOD

by Wadian Massoud  Apr    A  E  

Almost every culture or civilization has a unique cultural dance or music style that unifies its.. PERIOD

Designed by Elegant Themes  Powered by WordPress",Beyonce Archives | The Emory Wheel,Emory University
