,date,content,title,name
8701,2023-11-04,"a few passing clouds PERIOD Low 39F PERIOD Winds light and variable. pERIOD

A few passing clouds PERIOD Low 39F PERIOD Winds light and variable PERIOD

Updated November     pm

Were always interested in hearing about news in our community PERIOD Let us know whats going on

If youre interested in submitting a Letter to the Editor click here PERIOD

Humanities Week returned from Oct PERIOD  to  with free online and inperson events around Virginia Techs campus PERIOD

Virginia Tech mens soccer fell to No PERIOD  North Carolina Wednesday night in the first round of the ACC tournament  a loss that puts the nail in the coffin on the Hokies season PERIOD

While most of spooky seasons special events have come to pass fall is far from over with plenty of fun festivities still in store for Hokies hoping to embrace all the season has to offer PERIOD Southwest Virginia hosts events and has natural beauty for students to enjoy with family friends or 

An open letter to President Sands

Search salaries of employees from Virginia Tech and other universities dating back to  PERIOD

by Julie Halenar

Associated Press

BALTIMORE  The darkness and terror of Edgar Allan Poes writing is captured by renowned French artists in illustrations on display at The Baltimore Museum of Art PERIOD

With ravens and black cats coming out of the shadows the artists illustrate the eerie poems and stories by Poe who died in Baltimore at the age of  after collapsing in the street PERIOD

There are also portraits of the famous writer known for his disturbing and thrilling words and a few firstedition illustrated books from the 1800s in the onegallery exhibit opening Wednesday PERIOD

The 20print exhibit has Edouard Manets etchings for Poes poem The Raven including the narrator standing next to an open shutter watching the raven in Open here I Flung the Shutter The Window  PERIOD Other illustrations show the narrator at his desk over many a quaint and curious volume of forgotten lore the raven perched upon a bust of Pallas and the shadow that lies floating on the floor. manet used the image of French poet Stephane Mallarme to draw the narrator for the etchings PERIOD The French appreciated Poes writing before Americans with Mallarme and Charles Baudelaire translating his works said Jay Fisher the museums senior curator of prints drawings and photographs PERIOD











Log In

Keep it Clean PERIOD Please avoid obscene vulgar lewd
racist or sexuallyoriented language PERIOD
PLEASE TURN OFF YOUR CAPS LOCK PERIOD
Dont Threaten PERIOD Threats of harming another
person will not be tolerated PERIOD
Be Truthful PERIOD Dont knowingly lie about anyone
or anything PERIOD
Be Nice PERIOD No racism sexism or any sort of ism
that is degrading to another person PERIOD
Be Proactive PERIOD Use the Report link on
each comment to let us know of abusive posts PERIOD
Share with Us PERIOD Wed love to hear eyewitness
accounts the history behind an article PERIOD

Success An email has been sent to  with a link to confirm list signup PERIOD

Error There was an error processing your request PERIOD

Your browser is out of date and potentially vulnerable to security risks.We recommend switching to one of the following browsers",?The Raven? writer appears in art  | Lifestyle | collegiatetimes.com,Virginia Polytechnic Institute
