,date,content,title,name
2716,2023-11-04,"the Eckerd Tritons took the FGCU Eagles floor on Saturday afternoon ready to face its second Division I opponent of the year PERIOD The Eagles struggled against theDivision II team fighting for the.. PERIOD

The Diverging Diamond Intersection Why its Coming to Fort Myers     Views

From MTV to FGCU John Lack Shares His Journalism Experience     Views

FGCUs Beach Club Makes a Splash This Semester     Views

UPD Beat Police Receive Complaint About a Student Playing Manhunt     Views

Upcoming Fall Activities to Do in Fort Myers     Views",eckerd – Eagle Media,Florida Gulf Coast University
