,date,content,title,name
6654,2016-03-26,"the Michigan Daily

One hundred and thirtythree years of editorial freedom

Jim Harbaugh won fourth place in the University of Michigans  executive Central Student Government election the same standing he achieved in last years election according to unofficial results released Saturday morning PERIOD

The name Jim Harbaugh which could refer either to Michigan Football coach Jim Harbaugh or the coachs son James Harbaugh an LSA freshman garnered  votes exactly  votes over last years total PERIOD The Defend Affirmative Action Party garnered third place with  votes PERIOD

After his fourthplace finish last year Harbaugh the coach tweeted that he was disappointed with the results PERIOD

Competitive juices flowing the tweet read PERIOD Hat in the ring for   will campaign w EUTM





Harbaugh also won one of ten representative positions for the Rackham School of Graduate Studies on the assembly but was disqualified due to not being enrolled in the school PERIOD





Jim Harbaugh for head coach  CSG president  athletic director  school president  tenured lecturer  dining hall employee  mbus driver



Many variations of the name Harbaugh were also reported including JJJJJJIIIMMMMMM HHHAAARRRRBBBBAAAUUUGGGHHHH and Coach Harbaugh as well as a slate of executive tickets including Harbaugh and the Diag Squirrel PERIOD

Other offcampus individuals written in included U.S PERIOD Sen PERIOD Bernie Sanders DVt. and Ohio Governor John Kasich R candidates for the Democratic and Republican presidential nominations respectively as well as Thomas Jefferson and Darth Vader PERIOD



Please consider donating to The Michigan Daily

Your email address will not be published PERIOD Required fields are marked 

Comment 

Name 

Email 

Website

Save my name email and website in this browser for the next time I comment PERIOD







See the results

Play the latest crossword

Stanford Lipsey Student Publications Building

 Maynard St Ann Arbor MI 

Edited and managed by the students at the University of Michigan since",Jim Harbaugh takes fourth place in Central Student Government election,University of Michigan
