,date,content,title,name
9844,2021-08-30,"hi what are you looking for

Howards Office of Campus Life hosted a workshop Friday intended to give students a better understanding of the schools various student organizations and how.. PERIOD

By Jacinth JonesCampus Staff Writer Posted  PMEST Mon. sept PERIOD   It is no easy task being Howards oldest Afrocentric service organization and.. PERIOD

By Amber BroadenNewsEditor Posted  PMEST Sun. sept PERIOD   Anyone who wanted their portrait taken I would take it PERIOD I did not really.. PERIOD

Copyright   The Hilltop The Student Voice of Howard University",Student - The Hilltop,Howard University
